NOMBRE_CONVOCATORIA,AÑO_CONVOCATORIA,FECHA_NACIMIENTO_ASPIRANTE,GENERO_ASPIRANTE,DPTO_NACIMIENTO_ASPIRANTE,POSIBLES_INSTITUCIONES_DE_ESTUDIO,PROGRAMA_DOCTORAL,PROG_NAL_CYT,GRAN_AREA_CONOCIMIENTO_ESTUDIO,AREA_CONOCIMIENTO_ESTUDIO
Doctorados Exterior 2014,2014,01/01/1900 12:00:00 AM,FEMENINO,BOGOTA D C,Autonomous University of Madrid,Doctorado en Medicina Preventiva y Salud Publica,Ciencia Tecnologia e Innovacion en Salud,CIENCIAS MEDICAS Y DE LA SALUD,CIENCIAS DE LA SALUD
Doctorados Exterior 2014,2014,01/01/1900 12:00:00 AM,FEMENINO,VALLE DEL CAUCA,University of Lisbon,University of Lisbon Instituto de Medicina Molecular,Ciencia Tecnologia e Innovacion en Salud,CIENCIAS MEDICAS Y DE LA SALUD,BIOTECNOLOGIA EN SALUD
Doctorados Exterior 2014,2014,12/05/1982 12:00:00 AM,MASCULINO,SANTANDER,The University of Glasgow,Doctorate in Health Professions Education,Ciencia Tecnologia e Innovacion en Salud,CIENCIAS MEDICAS Y DE LA SALUD,MEDICINA CLINICA
Doctorados Exterior 2014,2014,01/01/1900 12:00:00 AM,MASCULINO,VALLE DEL CAUCA,University of Chile,Doctorado en Sistemas de Ingenieria,Ciencia Tecnologia e Innovacion en Ingenieria,INGENIERIA Y TECNOLOGIA,INGENIERIA CIVIL
Doctorados Exterior 2014,2014,01/01/1900 12:00:00 AM,MASCULINO,BOLIVAR,State University of Campinas,Instituto de Fisica Gleb Wataghin - Universidade Estadual de Campinas,Ciencias Basicas,CIENCIAS NATURALES,CIENCIAS FISICAS
Doctorados Exterior 2014,2014,01/01/1900 12:00:00 AM,MASCULINO,SANTANDER,University of Porto,PhD in Occupational Safety and Health,Ciencia Tecnologia e Innovacion en Salud,CIENCIAS MEDICAS Y DE LA SALUD,CIENCIAS DE LA SALUD
Doctorados Exterior 2014,2014,05/03/1979 12:00:00 AM,FEMENINO,BOGOTA D C,Autonomous University of Barcelona,Doctorado en educacion,Ciencia Tecnologia e Innovacion en Ciencias Humanas Sociales y  Educacion,CIENCIAS SOCIALES,CIENCIAS DE LA EDUCACION
Doctorados Exterior 2014,2014,10/03/1977 12:00:00 AM,FEMENINO,BOGOTA D C,University of Wisconsin - Madison,Journalism and Mass Communication PhD,Ciencia Tecnologia e Innovacion en Ciencias Humanas Sociales y  Educacion,CIENCIAS SOCIALES,PERIODISMO Y COMUNICACIONES
Doctorados Exterior 2014,2014,01/01/1900 12:00:00 AM,MASCULINO,VALLE DEL CAUCA,University of Massachusetts Amherst,Sociology,No Aplica,CIENCIAS SOCIALES,SOCIOLOGIA
Doctorados Exterior 2014,2014,01/01/1900 12:00:00 AM,FEMENINO,BOGOTA D C,University of Paris Descartes (Paris 5),Ciencias de la educacion,Ciencia Tecnologia e Innovacion en Ciencias Humanas Sociales y  Educacion,HUMANIDADES,OTRAS HUMANIDADES
Doctorados Exterior 2014,2014,01/01/1900 12:00:00 AM,MASCULINO,CALDAS,Cornell University,Doctorado en Ciencias Animales,Ciencia Tecnologia e Innovacion en Ciencias Agropecuarias,CIENCIAS AGRICOLAS,CIENCIAS ANIMALES Y LECHERIA
Doctorados Exterior 2014,2014,12/07/1983 12:00:00 AM,MASCULINO,BOGOTA D C,University of New South Wales,Doctor of Philosophy,Ciencia Tecnologia e Innovacion en Tecnologias de la Informacion y las Comunicaciones,CIENCIAS NATURALES,COMPUTACION Y CIENCIAS DE LA INFORMACION
Doctorados Exterior 2014,2014,06/01/1979 12:00:00 AM,MASCULINO,SANTANDER,Massey University,Doctor in Phiosophy,Ciencia Tecnologia e innovacion en Ambiente Biodiversidad y Habitat,CIENCIAS SOCIALES,GEOGRAFIA SOCIAL Y ECONOMICA
Doctorados Exterior 2014,2014,01/01/1900 12:00:00 AM,MASCULINO,BOLIVAR,University of Gothenburg,Global Change and Climate Economics,Ciencia Tecnologia e innovacion en Ambiente Biodiversidad y Habitat,CIENCIAS SOCIALES,ECONOMIA Y NEGOCIOS
Doctorados Exterior 2014,2014,02/05/1989 12:00:00 AM,FEMENINO,BOGOTA D C,The University of Queensland,Doctorado de la escuela de geografia planeacion y gerencia ambiental,Ciencia Tecnologia e innovacion en Ambiente Biodiversidad y Habitat,CIENCIAS NATURALES,CIENCIAS DE LA TIERRA Y MEDIOAMBIENTALES
Doctorados Exterior 2014,2014,06/07/1982 12:00:00 AM,MASCULINO,ANTIOQUIA,University of Paris Diderot (Paris 7),Doctorat en Histoire et Civilisations,Ciencia Tecnologia e Innovacion en Ciencias Humanas Sociales y  Educacion,HUMANIDADES,OTRAS HISTORIAS
Doctorados Exterior 2014,2014,01/01/1900 12:00:00 AM,MASCULINO,META,University of Barcelona,Investigacion Desarrolllo y Control de Medicamentos,Ciencia Tecnologia e Innovacion en Salud,CIENCIAS MEDICAS Y DE LA SALUD,OTRAS CIENCIAS MEDICAS
Doctorados Exterior 2014,2014,01/01/1900 12:00:00 AM,MASCULINO,ANTIOQUIA,Polytechnic University of Valencia,Doctorado en Ingenieria Civil y Urbanismo,Ciencia Tecnologia e Innovacion en Ingenieria,INGENIERIA Y TECNOLOGIA,INGENIERIA CIVIL
Doctorados Exterior 2014,2014,01/01/1900 12:00:00 AM,FEMENINO,BOGOTA D C,University of Groningen,PhD Program of the Graduate School of Medical Sciences,Ciencias Basicas,CIENCIAS MEDICAS Y DE LA SALUD,OTRAS CIENCIAS MEDICAS
Doctorados Exterior 2014,2014,01/01/1900 12:00:00 AM,MASCULINO,ATLANTICO,Michigan State University,Packaging,Ciencia Tecnologia e Innovacion en Ciencias Agropecuarias,INGENIERIA Y TECNOLOGIA,OTRAS INGENIERIAS Y TECNOLOGIAS
Doctorados Exterior 2014,2014,07/07/1973 12:00:00 AM,MASCULINO,SANTANDER,University of Valencia,Doctorado en Estadistica y Optimizacion,No Aplica,CIENCIAS NATURALES,MATEMATICA
Doctorados Exterior 2014,2014,01/01/1900 12:00:00 AM,MASCULINO,CORDOBA,Beijing Normal University,Chemical Physics,Ciencias Basicas,CIENCIAS NATURALES,MATEMATICA
Doctorados Exterior 2014,2014,01/01/1900 12:00:00 AM,FEMENINO,ANTIOQUIA,Iowa State University,Doctor of philosophy,Investigaciones en Energia y Mineria,INGENIERIA Y TECNOLOGIA,INGENIERIAS ELECTRICA ELECTRONICA E INFORMATICA
Doctorados Exterior 2014,2014,01/01/1900 12:00:00 AM,MASCULINO,BOGOTA D C,Massey University,Doctor of Philosophy in Economics,Ciencia Tecnologia e Innovacion en Ciencias Humanas Sociales y  Educacion,CIENCIAS SOCIALES,ECONOMIA Y NEGOCIOS
Doctorados Exterior 2014,2014,01/01/1900 12:00:00 AM,MASCULINO,ATLANTICO,University of Birmingham,PhD in Environmental Economics and Environmental Management,Ciencia Tecnologia e innovacion en Ambiente Biodiversidad y Habitat,CIENCIAS SOCIALES,ECONOMIA Y NEGOCIOS
Doctorados Exterior 2014,2014,06/05/1977 12:00:00 AM,FEMENINO,BOGOTA D C,The George Washington University,Applied Social Psychology,Ciencia Tecnologia e Innovacion en Ciencias Humanas Sociales y  Educacion,CIENCIAS SOCIALES,PSICOLOGIA
Doctorados Exterior 2014,2014,01/01/1900 12:00:00 AM,MASCULINO,BOLIVAR,University of Ottawa,PhD Rehabilitation Sciences,Ciencia Tecnologia e Innovacion en Salud,CIENCIAS MEDICAS Y DE LA SALUD,CIENCIAS DE LA SALUD
Doctorados Exterior 2013,2013,01/01/1900 12:00:00 AM,MASCULINO,BOGOTA D C,University of Texas at Austin,Ph.D. in Public Policy,Ciencia Tecnologia e Innovacion en Ciencias Humanas Sociales y  Educacion,OTRAS CIENCIAS SOCIALES,ESTUDIOS URBANOS PLANIFICACION Y DESARROLLO
Doctorados Exterior 2013,2013,01/01/1900 12:00:00 AM,MASCULINO,BOGOTA D C,Institute of Education University of London,Education and related areas (PhD / MPhil),Ciencia Tecnologia e Innovacion en Ciencias Humanas Sociales y  Educacion,OTRAS HUMANIDADES,EDUCACION GENERAL INCLUYE CAPACITACION PEDADOGIA
Doctorados Exterior 2013,2013,01/01/1900 12:00:00 AM,FEMENINO,VALLE DEL CAUCA,University of Bonn,Institut fur Organischen Landbau,Ciencia Tecnologia e Innovacion en Ciencias Agropecuarias,OTRAS CIENCIAS AGRICOLAS,AGRONOMIA
Doctorados Exterior 2013,2013,01/01/1900 12:00:00 AM,MASCULINO,BOGOTA D C,Chemnitz University of Technology,Doctorate - PhD,Ciencia Tecnologia e Innovacion en Tecnologias de la Informacion y las Comunicaciones,OTRAS INGENIERIAS Y TECNOLOGIAS,INGENIERIA ELECTRICA Y ELECTRONICA
Doctorados Exterior 2013,2013,01/01/1900 12:00:00 AM,FEMENINO,BOGOTA D C,University of California Davis,Ph.D. program in Anthropology,Ciencia Tecnologia e Innovacion en Ciencias Humanas Sociales y  Educacion,CIENCIAS NATURALES,CIENCIAS SOCIALES INTERDISCIPLINARIA
Doctorados Exterior 2013,2013,10/12/1976 12:00:00 AM,FEMENINO,QUINDIO,Universidad Estadual de Campinas,Doctorado en Matematica Aplicada,Ciencias Basicas,GEOCIENCIAS MULTIDISCIPLINARIO,MATEMATICAS PURAS
Doctorados Exterior 2013,2013,03/10/1976 12:00:00 AM,MASCULINO,ANTIOQUIA,University of Edinburgh,PhD Architecture,Ciencia Tecnologia e Innovacion en Ciencias Humanas Sociales y  Educacion,CIENCIAS NATURALES,CIENCIAS NATURALES
Doctorados Exterior 2014,2014,05/01/1967 12:00:00 AM,MASCULINO,BOYACA,University of Barcelona,Doctorate in Fetal and Perinatal Medicine.,Ciencia Tecnologia e Innovacion en Salud,CIENCIAS MEDICAS Y DE LA SALUD,MEDICINA CLINICA
Doctorados Exterior 2013,2013,01/01/1900 12:00:00 AM,MASCULINO,VALLE DEL CAUCA,Universitat Politecnica de Catalunya,Ph.D. in Computational and Applied Physics,Ciencias Basicas,GEOCIENCIAS MULTIDISCIPLINARIO,FISICA ATOMICA MOLECULAR Y QUIMICA
Doctorados Exterior 2013,2013,01/01/1900 12:00:00 AM,MASCULINO,BOGOTA D C,Universidad de Barcelona,PhD in Economics,Investigaciones en Energia y Mineria,OTRAS CIENCIAS SOCIALES,ECONOMIA
Doctorados Exterior 2013,2013,01/01/1900 12:00:00 AM,FEMENINO,ANTIOQUIA,Universitat De Valencia,Programa de Doctorado en Parasitologia Humana y Animal,Ciencias Basicas,OTRAS BIOLOGIAS,BIOLOGIA TEORICA MATEMATICA CRIOBIOLOGIA EVOLUTIVA
Doctorados Exterior 2013,2013,09/01/1980 12:00:00 AM,MASCULINO,SANTANDER,Universidad De Sao Paulo,Doctorado en Estadistica,Ciencias Basicas,GEOCIENCIAS MULTIDISCIPLINARIO,ESTADISTICAS Y PROBABILIDADES INVESTIGACION EN METODOLOGIAS
Doctorados Exterior 2013,2013,01/01/1900 12:00:00 AM,FEMENINO,BOGOTA D C,Universidad de Barcelona,Doctorado de Biomedicina,Ciencias Basicas,OTRAS CIENCIAS MEDICAS,MEDICINA GENERAL E INTERNA
Doctorados Exterior 2013,2013,02/05/1989 12:00:00 AM,MASCULINO,BOGOTA D C,University of Pennsylvania,Doctorado en Ciencias Juridicas (SJD),Ciencia Tecnologia e Innovacion en Ciencias Humanas Sociales y  Educacion,OTRAS CIENCIAS SOCIALES,DERECHO
Doctorados Exterior 2013,2013,01/01/1900 12:00:00 AM,FEMENINO,BOGOTA D C,Universita Bocconi,PhD in International Law and Economics,No Aplica,OTRAS CIENCIAS SOCIALES,DERECHO
Doctorados Exterior 2013,2013,01/01/1900 12:00:00 AM,FEMENINO,BOGOTA D C,Liverpool school of Tropical Medicine,Doctor of Philosophy - PhD,Ciencia Tecnologia e Innovacion en Salud,OTRAS BIOLOGIAS,OTRAS BIOLOGIAS
Doctorados Exterior 2013,2013,01/01/1900 12:00:00 AM,MASCULINO,BOGOTA D C,Ecole Des Hautes Etudes En Sciences Sociales,Histoire et civilisations,No Aplica,OTRAS HUMANIDADES,HISTORIA
Doctorados Exterior 2013,2013,01/01/1900 12:00:00 AM,FEMENINO,BOGOTA D C,ECOLE PRATIQUE DES HAUTES ETUDES,Ciencias de religion y sistemas de pensamiento,Ciencia Tecnologia e Innovacion en Ciencias Humanas Sociales y  Educacion,OTRAS HUMANIDADES,ANTROPOLOGIA
Doctorados Exterior 2013,2013,01/01/1900 12:00:00 AM,FEMENINO,BOGOTA D C,UNIVERSITY OF SOUTHAMPTON,Integrated MPhil/PhD Biomedical Science,Ciencia Tecnologia e Innovacion en Salud,OTRAS BIOLOGIAS,BIOLOGIA TEORICA MATEMATICA CRIOBIOLOGIA EVOLUTIVA
Doctorados Exterior 2013,2013,01/01/1900 12:00:00 AM,MASCULINO,SANTANDER,Universidade Do Porto,PhD in Occupational Safety and Health,Ciencia Tecnologia e Innovacion en Salud,OTRAS CIENCIAS MEDICAS,SALUD PUBLICA
Doctorados Exterior 2013,2013,10/03/1976 12:00:00 AM,FEMENINO,BOGOTA D C,Universidad Nacional De Quilmes,Doctorado en Ciencias sociales y humanas,Ciencia Tecnologia e Innovacion en Ciencias Humanas Sociales y  Educacion,OTRAS HUMANIDADES,SOCIOLOGIA
Doctorados Exterior 2013,2013,01/01/1900 12:00:00 AM,MASCULINO,HUILA,UNIVERSIDA SIMON BOLIVAR,DOCTORADO EN FISCA,Ciencias Basicas,GEOCIENCIAS MULTIDISCIPLINARIO,FISICA ATOMICA MOLECULAR Y QUIMICA
Doctorados Exterior 2013,2013,01/01/1900 12:00:00 AM,MASCULINO,VALLE DEL CAUCA,UNIVERSIDAD AUTONOMA DE BARCELONA,DOCTORADO EN EDUCACION,Ciencia Tecnologia e Innovacion en Ciencias Humanas Sociales y  Educacion,OTRAS HUMANIDADES,EDUCACION GENERAL INCLUYE CAPACITACION PEDADOGIA
Doctorados Exterior 2013,2013,12/07/1969 12:00:00 AM,FEMENINO,ANTIOQUIA,Universidad de Valencia Espana,INTERVENCION EDUCATIVA METODOS EVALUACION DIAGNOSTICO Y ORIEENTACION,No Aplica,OTRAS HUMANIDADES,EDUCACION GENERAL INCLUYE CAPACITACION PEDADOGIA
Doctorados Exterior 2013,2013,01/01/1900 12:00:00 AM,MASCULINO,BOGOTA D C,Universidad Federal do Rio de Janeiro,Programa de posgraduacion en politicas estrategias y desarrollo,Ciencia Tecnologia e innovacion en Ambiente Biodiversidad y Habitat,OTRAS CIENCIAS SOCIALES,ECONOMIA
Doctorados Exterior 2013,2013,01/01/1900 12:00:00 AM,FEMENINO,ANTIOQUIA,Universidade Federal Do Parana,Ciencias Biologicas,Ciencias Basicas,OTRAS BIOLOGIAS,ZOOLOGIA ORNITOLOGIA ENTOMOLOGIA CIENCIAS BIOLOGICAS DEL COMPORTAMIENTO
Doctorados Exterior 2013,2013,01/01/1900 12:00:00 AM,MASCULINO,QUINDIO,UNIVERSIDAD NACIONAL AUTONOMA DE MEXICO CAMPUS JURIQUILLA QUERETARO,Ingenieria Ambiental,Ciencia Tecnologia e Innovacion en Ingenieria,OTRAS INGENIERIAS Y TECNOLOGIAS,INGENIERIA AMBIENTAL Y GEOLOGICA
Doctorados Exterior 2013,2013,01/01/1900 12:00:00 AM,MASCULINO,SANTANDER,Ecole Practique des Hautes Etudes,religion y sistemas de pensamiento,Ciencia Tecnologia e Innovacion en Ciencias Humanas Sociales y  Educacion,OTRAS HUMANIDADES,ANTROPOLOGIA
Doctorados Exterior 2015,2015,07/11/1989 12:00:00 AM,FEMENINO,CALDAS,Polytechnic University of Catalonia,Doctorado en Ingenieria de Procesos Quimicos,Ciencias Basicas,INGENIERIA Y TECNOLOGIA,INGENIERIA QUIMICA
Doctorados Exterior 2013,2013,01/01/1900 12:00:00 AM,FEMENINO,ATLANTICO,University of Massachusetts Amherst,PhD in Anthropology,Ciencia Tecnologia e Innovacion en Ciencias Humanas Sociales y  Educacion,OTRAS HUMANIDADES,ANTROPOLOGIA
Doctorados Exterior 2013,2013,06/11/1978 12:00:00 AM,FEMENINO,SANTANDER,UNIVERSIDAD POLITECNICA DE MADRID,Economia Agraria Alimentaria y de los Recursos Naturales,Ciencia Tecnologia e Innovacion en Ciencias Agropecuarias,OTRAS CIENCIAS SOCIALES,ECONOMIA
Doctorados Exterior 2014,2014,01/01/1900 12:00:00 AM,FEMENINO,NARINO,Florida State University,Ph.D. in Urban and Regional Planning,Ciencia Tecnologia e Innovacion en Ciencias Humanas Sociales y  Educacion,CIENCIAS SOCIALES,OTRAS CIENCIAS SOCIALES
Doctorados Exterior 2013,2013,01/01/1900 12:00:00 AM,FEMENINO,ANTIOQUIA,Universidad Politecnica de Madrid,Doctorado en Software Sistemas y Computacion,Ciencia Tecnologia e Innovacion en Tecnologias de la Informacion y las Comunicaciones,GEOCIENCIAS MULTIDISCIPLINARIO,CIENCIAS DE LA COMPUTACION
Doctorados Exterior 2013,2013,01/01/1900 12:00:00 AM,MASCULINO,BOLIVAR,Universidad de Puerto Rico-Mayaguez,Quimica,Ciencias Basicas,GEOCIENCIAS MULTIDISCIPLINARIO,QUIMICA ORGANICA
Doctorados Exterior 2013,2013,02/05/1981 12:00:00 AM,MASCULINO,RISARALDA,Universidade de Sao Paulo,Ingenieria Metalurgica y de Materiales,Ciencia Tecnologia e Innovacion en Ingenieria,OTRAS INGENIERIAS Y TECNOLOGIAS,COMPUESTOS LAMINADOS PLASTICOS REFORZADOS FIBRA SINTETICAS Y NATURALES ETC
Doctorados Exterior 2013,2013,02/06/1987 12:00:00 AM,FEMENINO,BOGOTA D C,Universidad Autonoma de Barcelona,Doctorado en Historia de la Ciencia,Ciencia Tecnologia e Innovacion en Ciencias Humanas Sociales y  Educacion,OTRAS HUMANIDADES,HISTORIA
Doctorados Exterior 2013,2013,10/03/1979 12:00:00 AM,FEMENINO,CHOCO,Universidad Complutense de Madrid,Doctorado en Conocimientos Pedagogicos Avanzados,Ciencia Tecnologia e Innovacion en Ciencias Humanas Sociales y  Educacion,OTRAS HUMANIDADES,EDUCACION GENERAL INCLUYE CAPACITACION PEDADOGIA
Doctorados Exterior 2013,2013,09/02/1985 12:00:00 AM,MASCULINO,TOLIMA,universidad estadual paulista julio de mesquita filho,Ciencias Biologicas-Genetica,Ciencias Basicas,OTRAS BIOLOGIAS,GENETICA Y HERENCIA
Doctorados Exterior 2013,2013,01/01/1900 12:00:00 AM,MASCULINO,CAUCA,1.	UNIVERSIDAD DE SALAMANCA,Doctorado en Estudios Sociales de la Ciencia y la Tecnologia,Ciencia Tecnologia e Innovacion en Ciencias Humanas Sociales y  Educacion,OTRAS CIENCIAS SOCIALES,ECONOMIA
Doctorados Exterior 2013,2013,02/04/1988 12:00:00 AM,MASCULINO,BOGOTA D C,The University of Hull,PhD escuela de negocios area de estrategia y mercadeo,Ciencia Tecnologia e Innovacion en Ciencias Humanas Sociales y  Educacion,OTRAS CIENCIAS SOCIALES,NEGOCIOS Y MANAGEMENT
Doctorados Exterior 2013,2013,01/01/1900 12:00:00 AM,MASCULINO,CALDAS,UNIVERSIDADE FEDERAL DO RIO DE JANEIRO,Doctorado en Matematicas,Ciencias Basicas,GEOCIENCIAS MULTIDISCIPLINARIO,MATEMATICAS PURAS
Doctorados Exterior 2013,2013,11/08/1980 12:00:00 AM,MASCULINO,ANTIOQUIA,University of Southampton,Doctor of Philosophy Phd in Engineering  the Environment,Ciencia Tecnologia e Innovacion en Ingenieria,OTRAS INGENIERIAS Y TECNOLOGIAS,INGENIERIA MECANICA
Doctorados Exterior 2014,2014,01/01/1900 12:00:00 AM,MASCULINO,ANTIOQUIA,University of Delaware,Electrical and Computer Engineering (PhD),Ciencia Tecnologia e Innovacion en Tecnologias de la Informacion y las Comunicaciones,INGENIERIA Y TECNOLOGIA,INGENIERIAS ELECTRICA ELECTRONICA E INFORMATICA
Doctorados Exterior 2014,2014,01/01/1900 12:00:00 AM,MASCULINO,BOGOTA D C,University of Chile,Doctorado en Ciencias Biomedicas,Ciencias Basicas,CIENCIAS MEDICAS Y DE LA SALUD,CIENCIAS DE LA SALUD
Doctorados Exterior 2014,2014,01/01/1900 12:00:00 AM,MASCULINO,CORDOBA,McMaster University,Health Research Methodology,Ciencia Tecnologia e Innovacion en Salud,CIENCIAS MEDICAS Y DE LA SALUD,CIENCIAS DE LA SALUD
Doctorados Exterior 2014,2014,11/02/1982 12:00:00 AM,FEMENINO,QUINDIO,University of Montpellier 2,Sciences du Langage,Ciencia Tecnologia e Innovacion en Ciencias Humanas Sociales y  Educacion,HUMANIDADES,IDIOMAS Y LITERATURA
Doctorados Exterior 2014,2014,01/01/1900 12:00:00 AM,MASCULINO,CUNDINAMARCA,University of Sao Paulo,Suelos y nutricion de plantas,Ciencia Tecnologia e Innovacion en Ciencias Agropecuarias,CIENCIAS AGRICOLAS,AGRICULTURA SILVICULTURA Y PESCA
Doctorados Exterior 2014,2014,01/01/1900 12:00:00 AM,MASCULINO,BOGOTA D C,Sao Paulo State University,Doutorado em Estudos Literarios,No Aplica,HUMANIDADES,IDIOMAS Y LITERATURA
Doctorados Exterior 2014,2014,01/01/1900 12:00:00 AM,MASCULINO,SANTANDER,McGill University,PhD Computer Science (McGill University),Ciencia Tecnologia e Innovacion en Tecnologias de la Informacion y las Comunicaciones,CIENCIAS NATURALES,COMPUTACION Y CIENCIAS DE LA INFORMACION
Doctorados Exterior 2014,2014,01/01/1900 12:00:00 AM,FEMENINO,BOGOTA D C,Concordia University,PhD en Psicologia,Ciencia Tecnologia e Innovacion en Ciencias Humanas Sociales y  Educacion,CIENCIAS SOCIALES,PSICOLOGIA
Doctorados Exterior 2014,2014,01/01/1900 12:00:00 AM,FEMENINO,QUINDIO,University of Leicester,M.Res (physical chemistry)Ph.D in chemistry by research,Ciencias Basicas,CIENCIAS NATURALES,CIENCIAS QUIMICAS
Doctorados Exterior 2014,2014,01/01/1900 12:00:00 AM,MASCULINO,BOGOTA D C,University of Barcelona,Doctorado en Historia Economica,Ciencia Tecnologia e Innovacion en Ciencias Humanas Sociales y  Educacion,HUMANIDADES,OTRAS HISTORIAS
Doctorados Exterior 2014,2014,01/01/1900 12:00:00 AM,MASCULINO,ANTIOQUIA,Purdue University - West Lafayette,Engineering Education,Ciencia Tecnologia e Innovacion en Ciencias Humanas Sociales y  Educacion,CIENCIAS SOCIALES,CIENCIAS DE LA EDUCACION
Doctorados Exterior 2014,2014,06/04/1983 12:00:00 AM,MASCULINO,BOGOTA D C,University of Geneva,Anthropology and Sociology of Development,Ciencia Tecnologia e innovacion en Ambiente Biodiversidad y Habitat,CIENCIAS SOCIALES,SOCIOLOGIA
Doctorados Exterior 2014,2014,04/11/1984 12:00:00 AM,MASCULINO,ANTIOQUIA,Technical University Munich,Medical Life Science and Technology,Ciencia Tecnologia e Innovacion en Salud,INGENIERIA Y TECNOLOGIA,INGENIERIA MEDICA
Doctorados Exterior 2014,2014,01/01/1900 12:00:00 AM,FEMENINO,BOGOTA D C,University College London,Funciones ejecutivas en Adolesencia,Ciencia Tecnologia e Innovacion en Ciencias Humanas Sociales y  Educacion,CIENCIAS SOCIALES,PSICOLOGIA
Doctorados Exterior 2014,2014,01/01/1900 12:00:00 AM,FEMENINO,BOGOTA D C,Harvard University,Prueba,Ciencias del Mar y los Recursos Hidrobiologicos,INGENIERIA Y TECNOLOGIA,INGENIERIAS ELECTRICA ELECTRONICA E INFORMATICA
Doctorados Exterior 2014,2014,01/01/1900 12:00:00 AM,FEMENINO,ANTIOQUIA,University of Barcelona,Doctorado en Alimentacion y Nutricion,Ciencia Tecnologia e Innovacion en Salud,CIENCIAS MEDICAS Y DE LA SALUD,CIENCIAS DE LA SALUD
Doctorados Exterior 2014,2014,04/12/1980 12:00:00 AM,FEMENINO,BOGOTA D C,Autonomous University of Madrid,Doctorado en Antropologia de Orientacion publica,Ciencia Tecnologia e Innovacion en Ciencias Humanas Sociales y  Educacion,HUMANIDADES,OTRAS HUMANIDADES
Doctorados Exterior 2014,2014,01/01/1900 12:00:00 AM,MASCULINO,BOGOTA D C,Cornell University,Ph.D in fiber science,Ciencias Basicas,CIENCIAS NATURALES,CIENCIAS QUIMICAS
Doctorados Exterior 2014,2014,01/01/1900 12:00:00 AM,FEMENINO,ATLANTICO,The University of Sheffield,PhD in psychology,Ciencia Tecnologia e Innovacion en Ciencias Humanas Sociales y  Educacion,CIENCIAS SOCIALES,PSICOLOGIA
Doctorados Exterior 2014,2014,01/01/1900 12:00:00 AM,FEMENINO,SANTANDER,State University of Campinas,Doutorado em Educacao,Ciencia Tecnologia e Innovacion en Ciencias Humanas Sociales y  Educacion,CIENCIAS SOCIALES,CIENCIAS DE LA EDUCACION
Doctorados Exterior 2014,2014,01/01/1900 12:00:00 AM,MASCULINO,HUILA,Autonomous University of Madrid,DOCTORADO EN MEDICINA Y CIRUGIA (Universidad Autonoma de Madrid),Ciencia Tecnologia e Innovacion en Salud,CIENCIAS MEDICAS Y DE LA SALUD,MEDICINA CLINICA
Doctorados Exterior 2014,2014,04/02/1982 12:00:00 AM,MASCULINO,QUINDIO,University of Granada,Ciencia y Tecnologia Industrial y Ambiental,Ciencia Tecnologia e Innovacion en Ingenieria,INGENIERIA Y TECNOLOGIA,INGENIERIA AMBIENTAL
Doctorados Exterior 2014,2014,01/01/1900 12:00:00 AM,MASCULINO,ANTIOQUIA,Purdue University - West Lafayette,Botany and Plant Pathology,Ciencia Tecnologia e Innovacion en Ciencias Agropecuarias,CIENCIAS AGRICOLAS,BIOTECNOLOGIA AGRICOLA
Doctorados Exterior 2014,2014,01/01/1900 12:00:00 AM,MASCULINO,BOGOTA D C,Delft University of Technology,Technical Institute of Delft (TU Delft)- Hydroinformatic,Ciencia Tecnologia e innovacion en Ambiente Biodiversidad y Habitat,INGENIERIA Y TECNOLOGIA,INGENIERIA CIVIL
Doctorados Exterior 2014,2014,01/01/1900 12:00:00 AM,FEMENINO,BOGOTA D C,Trinity College Dublin,Doctoral Degree in Clinical Psychology,Ciencia Tecnologia e Innovacion en Ciencias Humanas Sociales y  Educacion,CIENCIAS SOCIALES,PSICOLOGIA
Doctorados Exterior 2014,2014,01/01/1900 12:00:00 AM,MASCULINO,ATLANTICO,The Ohio State University - Columbus,PhD in Public Policy and Management,Ciencia Tecnologia e Innovacion en Ciencias Humanas Sociales y  Educacion,CIENCIAS SOCIALES,ECONOMIA Y NEGOCIOS
Doctorados Exterior 2014,2014,03/07/1990 12:00:00 AM,MASCULINO,CAUCA,Catholic University of Chile,doctorado en ciencias biologicas mencion en ecologia,Ciencia Tecnologia e innovacion en Ambiente Biodiversidad y Habitat,CIENCIAS NATURALES,CIENCIAS BIOLOGICAS
Doctorados Exterior 2014,2014,04/08/1987 12:00:00 AM,FEMENINO,SANTANDER,The University of Texas at Austin,Doctoral program in Behavioral Neuroscience at the Department of Psychology,Ciencias Basicas,CIENCIAS SOCIALES,PSICOLOGIA
Doctorados Exterior 2014,2014,05/10/1985 12:00:00 AM,MASCULINO,BOGOTA D C,York University,PhD Education,Ciencia Tecnologia e Innovacion en Ciencias Humanas Sociales y  Educacion,CIENCIAS SOCIALES,CIENCIAS DE LA EDUCACION
Doctorados Exterior 2014,2014,12/10/1990 12:00:00 AM,MASCULINO,CUNDINAMARCA,Purdue University - West Lafayette - Purdue University - West Lafayette,Doctorado en ciencias biologicas,Ciencias Basicas,CIENCIAS NATURALES,CIENCIAS BIOLOGICAS
Doctorados Exterior 2014,2014,01/01/1900 12:00:00 AM,FEMENINO,ANTIOQUIA,University College London,Surgery and Interventional Science,Ciencia Tecnologia e Innovacion en Salud,CIENCIAS MEDICAS Y DE LA SALUD,MEDICINA BASICA
Doctorados Exterior 2014,2014,09/03/1964 12:00:00 AM,MASCULINO,META,University of Canterbury,PHD  on  Engineering,Ciencia Tecnologia e Innovacion en Salud,INGENIERIA Y TECNOLOGIA,INGENIERIA MEDICA
Doctorados Exterior 2014,2014,01/01/1900 12:00:00 AM,MASCULINO,BOGOTA D C,Catholic University of Leuven,Doctoral Education Programme - PhD MTM,Ciencia Tecnologia e innovacion en Ambiente Biodiversidad y Habitat,INGENIERIA Y TECNOLOGIA,INGENIERIA AMBIENTAL
Doctorados Exterior 2014,2014,11/11/1980 12:00:00 AM,FEMENINO,CUNDINAMARCA,Polytechnic University of Valencia,Doctorado en Ciencia Tecnologia y Gestion Alimentaria,Ciencia Tecnologia e Innovacion en Ciencias Agropecuarias,INGENIERIA Y TECNOLOGIA,OTRAS INGENIERIAS Y TECNOLOGIAS
Doctorados Exterior 2014,2014,05/11/1968 12:00:00 AM,MASCULINO,BOGOTA D C,University of Alberta,PhD with specialization in Systematics and Evolution,Ciencias Basicas,CIENCIAS NATURALES,CIENCIAS BIOLOGICAS
Doctorados Exterior 2014,2014,01/01/1900 12:00:00 AM,MASCULINO,NORTE DE SANTANDER,University of Barcelona,CIENCIA COGNITIVA Y LENGUAJE,Ciencia Tecnologia e Innovacion en Ciencias Humanas Sociales y  Educacion,CIENCIAS SOCIALES,PSICOLOGIA
Doctorados Exterior 2014,2014,01/01/1900 12:00:00 AM,MASCULINO,SANTANDER,Erasmus University,Doctorado en Epidemiologia Clinica,Ciencia Tecnologia e Innovacion en Salud,CIENCIAS MEDICAS Y DE LA SALUD,OTRAS CIENCIAS MEDICAS
Doctorados Exterior 2014,2014,03/10/1977 12:00:00 AM,FEMENINO,VALLE DEL CAUCA,University College London,Research Degree Development Planning Unit,Ciencia Tecnologia e Innovacion en Ciencias Humanas Sociales y  Educacion,CIENCIAS SOCIALES,OTRAS CIENCIAS SOCIALES
Doctorados Exterior 2014,2014,01/01/1900 12:00:00 AM,MASCULINO,ANTIOQUIA,University of Sao Paulo,Doutorado em Engenharia Mecanica em Energia e Fluidos,Investigaciones en Energia y Mineria,INGENIERIA Y TECNOLOGIA,INGENIERIA MECANICA
Doctorados Exterior 2014,2014,01/01/1900 12:00:00 AM,FEMENINO,BOGOTA D C,University of Southampton,Mphil/PhD Human development  Health,Ciencia Tecnologia e Innovacion en Salud,CIENCIAS MEDICAS Y DE LA SALUD,CIENCIAS DE LA SALUD
