NOMBRE_CONVOCATORIA,AÑO_CONVOCATORIA,FECHA_NACIMIENTO_ASPIRANTE,GENERO_ASPIRANTE,DPTO_NACIMIENTO_ASPIRANTE,POSIBLES_INSTITUCIONES_DE_ESTUDIO,PROGRAMA_DOCTORAL,PROG_NAL_CYT,GRAN_AREA_CONOCIMIENTO_ESTUDIO,AREA_CONOCIMIENTO_ESTUDIO
Doctorados Exterior 2012,2012,12/05/1988 12:00:00 AM,FEMENINO,ANTIOQUIA,University Of Dundee - Wageningen University - Texas AM University,Doctor of Philosophy-PhD Life Sciences,Ciencia Tecnologia e Innovacion en Ciencias Agropecuarias,OTRAS CIENCIAS AGRICOLAS,AGRONOMIA
Doctorados Exterior 2013,2013,06/07/1986 12:00:00 AM,FEMENINO,ANTIOQUIA,University of Copenhagen,PhD Science - Plant Sciences,Biotecnologia,OTRAS BIOLOGIAS,OTRAS BIOLOGIAS
Doctorados Exterior 2012,2012,11/02/1983 12:00:00 AM,FEMENINO,BOGOTA D C,Georg August Universitat Gottingen Alemania - The International Max Planck Research School for Molecular Cell Biology  - Georgetown University,The international Masters/PhD Molecular Biology Program,Ciencias Basicas,OTRAS BIOLOGIAS,BIOQUIMICA Y BIOLOGIA MOLECULAR
Doctorados Exterior 2012,2012,01/01/1900 12:00:00 AM,MASCULINO,BOGOTA D C,OREGON STATE UNIVERSITY - Standford University - Mississippi State University,ENVIRONMENTAL SCIENCES PROGRAM,Ciencia Tecnologia e innovacion en Ambiente Biodiversidad y Habitat,OTRAS BIOLOGIAS,ECOLOGIA
Doctorados Exterior 2012,2012,02/09/1988 12:00:00 AM,FEMENINO,BOGOTA D C,Universidad de Melbourne,Ph.D.- Science in the School of Chemistry,Ciencia Tecnologia e Innovacion en Salud,GEOCIENCIAS MULTIDISCIPLINARIO,QUIMICA ORGANICA
Doctorados Exterior 2012,2012,01/06/1986 12:00:00 AM,MASCULINO,BOLIVAR,Otago University - University of Surrey - University of Agder,Energy Studies,Investigaciones en Energia y Mineria,CIENCIAS NATURALES,CIENCIAS NATURALES
Doctorados Exterior 2012,2012,01/01/1900 12:00:00 AM,MASCULINO,CUNDINAMARCA,Universidade Estadual de Campinas - Universidade Federal do Rio de Janeiro  - Universidade Federal do Rio de Janeiro,Doctorado en Historia (dos primeras opciones),Ciencia Tecnologia e Innovacion en Ciencias Humanas Sociales y  Educacion,OTRAS HUMANIDADES,HISTORIA
Doctorados Exterior 2012,2012,01/01/1900 12:00:00 AM,FEMENINO,BOGOTA D C,Cornell University - Maryland University - Boston University,Microbiologia/Epidemiologia Molecular/Enfermedades Infecciosas,Ciencia Tecnologia e Innovacion en Salud,OTRAS BIOLOGIAS,BIOLOGIA CELULAR Y MICROBIOLOGIA
Doctorados Exterior 2012,2012,01/01/1900 12:00:00 AM,FEMENINO,BOGOTA D C,university of utrecht  - Technical University of Denmark - University of Guelph,PhD programa,Ciencia Tecnologia e Innovacion en Salud,OTRAS BIOLOGIAS,OTRAS BIOLOGIAS
Doctorados Exterior 2012,2012,01/01/1900 12:00:00 AM,MASCULINO,CAUCA,Purdue University - texas a  m university - Virginia Tech,Doctor of Philosophy (Ph.D) Civil Engineering,Ciencia Tecnologia e innovacion en Ambiente Biodiversidad y Habitat,OTRAS INGENIERIAS Y TECNOLOGIAS,INGENIERIA CIVIL
Doctorados Exterior 2012,2012,01/01/1900 12:00:00 AM,MASCULINO,BOGOTA D C,Bournemouth University - Tennesse University - Florida University,Antropologia Biologica,Ciencias Basicas,OTRAS HUMANIDADES,ANTROPOLOGIA
Doctorados Exterior 2012,2012,01/01/1900 12:00:00 AM,FEMENINO,VALLE DEL CAUCA,Purdue University - University of Missouri  - CORNELL UNIVERSITY,Biologia,Ciencias Basicas,OTRAS BIOLOGIAS,ECOLOGIA
Doctorados Exterior 2012,2012,07/10/1980 12:00:00 AM,FEMENINO,CUNDINAMARCA,PONTIFICIA UNIVERSIDAD CATOLICA DE CHILE - UNIVERSIDAD DE BUENOS AIRES - Universidad de Campinas,DOCTORADO EN CIENCIAS DE LA INGENIERIA,Ciencia Tecnologia e Innovacion en Tecnologias de la Informacion y las Comunicaciones,GEOCIENCIAS MULTIDISCIPLINARIO,CIENCIAS DE LA COMPUTACION
Doctorados Exterior 2012,2012,06/09/1988 12:00:00 AM,FEMENINO,BOGOTA D C,Max Planck Institute - Max Planck Institute - Duke University,Biologia Celular Molecular y Genetica,Ciencias Basicas,OTRAS BIOLOGIAS,OTRAS BIOLOGIAS
Doctorados Exterior 2012,2012,10/08/1979 12:00:00 AM,MASCULINO,CHOCO,Stony Brook University,PhD in Physiology and Biophysics,Ciencia Tecnologia e Innovacion en Salud,OTRAS BIOLOGIAS,BIOLOGIA TEORICA MATEMATICA CRIOBIOLOGIA EVOLUTIVA
Doctorados Exterior 2012,2012,07/08/1983 12:00:00 AM,MASCULINO,ATLANTICO,Western Michigan University,Doctor of Philosophy in Industrial Engineering,Ciencia Tecnologia e Innovacion en Salud,OTRAS INGENIERIAS Y TECNOLOGIAS,INGENIERIA DE PRODUCCION
Doctorados Exterior 2012,2012,09/09/1979 12:00:00 AM,MASCULINO,BOGOTA D C,UNIVERSIDADE FEDERAL DO RIO DE JANEIRO - Shanghai Jiao Tong University  - Istanbul University,POSGRADO EN URBANISMO PHD,Ciencia Tecnologia e Innovacion en Ciencias Humanas Sociales y  Educacion,OTRAS CIENCIAS SOCIALES,ARQUITECTURA Y URBANISMO
Doctorados Exterior 2012,2012,01/01/1900 12:00:00 AM,FEMENINO,ANTIOQUIA,University of Leicester,Fisiologia y Farmacologia celular,Ciencia Tecnologia e Innovacion en Salud,OTRAS BIOLOGIAS,OTRAS BIOLOGIAS
Doctorados Exterior 2012,2012,07/05/1979 12:00:00 AM,MASCULINO,BOGOTA D C,Universite du montreal -  McGill university - Universidad de Montreal,Bio-informatique,Ciencias Basicas,GEOCIENCIAS MULTIDISCIPLINARIO,QUIMICA ORGANICA
Doctorados Exterior 2012,2012,01/01/1900 12:00:00 AM,FEMENINO,NORTE DE SANTANDER,PACE University - George Washington University - Yale University,Doctorado en Derecho,Ciencia Tecnologia e Innovacion en Ciencias Humanas Sociales y  Educacion,OTRAS CIENCIAS SOCIALES,DERECHO
Doctorados Exterior 2012,2012,11/03/1974 12:00:00 AM,MASCULINO,BOGOTA D C,Instituto Nacional De Pesquisas Da Amazonia,Doctorado en Entomologia,Ciencia Tecnologia e innovacion en Ambiente Biodiversidad y Habitat,OTRAS BIOLOGIAS,ZOOLOGIA ORNITOLOGIA ENTOMOLOGIA CIENCIAS BIOLOGICAS DEL COMPORTAMIENTO
Doctorados Exterior 2012,2012,01/01/1900 12:00:00 AM,FEMENINO,VALLE DEL CAUCA,University of Massachusetts,AFRICAN AMERICAN STUDIES PHD,No Aplica,CIENCIAS NATURALES,CIENCIAS NATURALES
Doctorados Exterior 2012,2012,01/01/1900 12:00:00 AM,MASCULINO,BOLIVAR,Tokyo Institute Of Technology - Ritsumeikan University - TOKYO UNIVERSITY OF SCIENCE,Management of Technology or Innovation,Ciencia Tecnologia e Innovacion en Tecnologias de la Informacion y las Comunicaciones,OTRAS INGENIERIAS Y TECNOLOGIAS,INGENIERIA DE PRODUCCION
Doctorados Exterior 2012,2012,01/01/1900 12:00:00 AM,FEMENINO,VALLE DEL CAUCA,University of Victoria,Graduate Studies PhD,Ciencia Tecnologia e Innovacion en Tecnologias de la Informacion y las Comunicaciones,GEOCIENCIAS MULTIDISCIPLINARIO,CIENCIAS DE LA COMPUTACION
Doctorados Exterior 2012,2012,01/01/1900 12:00:00 AM,MASCULINO,VALLE DEL CAUCA,Universidade de Sao Paulo - Universidad Estadual de Campinas,Doutorado em Energia,No Aplica,OTRAS INGENIERIAS Y TECNOLOGIAS,INGENIERIA ELECTRICA Y ELECTRONICA
Doctorados Exterior 2012,2012,09/04/1989 12:00:00 AM,MASCULINO,BOGOTA D C,The Australian National University,Doctor of Philosophy - PhD - Research School of Biology,Ciencia Tecnologia e innovacion en Ambiente Biodiversidad y Habitat,OTRAS BIOLOGIAS,GENETICA Y HERENCIA
Doctorados Exterior 2012,2012,01/01/1900 12:00:00 AM,FEMENINO,CAUCA,University of Reading,PhD in Chemistry,Ciencias Basicas,GEOCIENCIAS MULTIDISCIPLINARIO,QUIMICA ORGANICA
Doctorados Exterior 2012,2012,01/01/1900 12:00:00 AM,MASCULINO,ANTIOQUIA,Instituto de Ciencias Politicas de Paris - Universite De Paris Ix (Paris-Dauphine) - Columbia University New York,Programme doctoral (Ph.D.) en Science Politique,Ciencia Tecnologia e Innovacion en Ciencias Humanas Sociales y  Educacion,OTRAS HUMANIDADES,CIENCIAS POLITICAS
Doctorados Exterior 2012,2012,09/06/1982 12:00:00 AM,MASCULINO,ATLANTICO,Stanford University - University of California Berkeley - Princeton University,Doctor of Philosophy in Mechanical Engineering,No Aplica,OTRAS INGENIERIAS Y TECNOLOGIAS,INGENIERIA MECANICA
Doctorados Exterior 2012,2012,01/01/1900 12:00:00 AM,FEMENINO,BOYACA,University of Warwick - Queen Mary University of London - University College London,MPhil/PhD Law,No Aplica,OTRAS CIENCIAS SOCIALES,DERECHO
Doctorados Exterior 2012,2012,03/09/1985 12:00:00 AM,FEMENINO,CHOCO,University Of Manchester - London School of Economics,Development Policy and Management PhD,Ciencia Tecnologia e Innovacion en Ciencias Humanas Sociales y  Educacion,OTRAS HUMANIDADES,CIENCIAS SOCIALES INTERDISCIPLINARIA
Doctorados Exterior 2012,2012,10/12/1975 12:00:00 AM,MASCULINO,CORDOBA,Ohio University. College Of Arts And Sciences - University of Texas at Austin - Columbia University In The City of New York,Ph.D. in Mass Communication,Ciencia Tecnologia e Innovacion en Ciencias Humanas Sociales y  Educacion,OTRAS CIENCIAS SOCIALES,MEDIOS Y COMUNICACION SOCIAL
Doctorados Exterior 2012,2012,03/01/1986 12:00:00 AM,FEMENINO,SANTANDER,UNIVERSITY OF DELAWARE,Ph.D. in Electrical and Computer Engineering,Ciencia Tecnologia e Innovacion en Tecnologias de la Informacion y las Comunicaciones,GEOCIENCIAS MULTIDISCIPLINARIO,CIENCIAS DE LA COMPUTACION
Doctorados Exterior 2012,2012,01/01/1900 12:00:00 AM,FEMENINO,ARAUCA,Kobe University,Phd in Mathematics,Ciencias Basicas,GEOCIENCIAS MULTIDISCIPLINARIO,MATEMATICAS PURAS
Doctorados Exterior 2012,2012,10/03/1985 12:00:00 AM,FEMENINO,VALLE DEL CAUCA,University College London,PhD in Spanish and Latin American Studies,Ciencia Tecnologia e Innovacion en Ciencias Humanas Sociales y  Educacion,OTRAS HUMANIDADES,HISTORIA
Doctorados Exterior 2012,2012,01/12/1988 12:00:00 AM,FEMENINO,BOGOTA D C,Birbeck University of London - University of Surrey - City University London,PhD en Psicologia,Ciencia Tecnologia e Innovacion en Ciencias Humanas Sociales y  Educacion,OTRAS HUMANIDADES,PSICOLOGIA INCLUYE TERAPIAS DE APRENDIZAJE HABLA VISUAL Y OTRAS DISCAPACIDADES FISICAS Y MENTALES
Doctorados Exterior 2012,2012,01/01/1900 12:00:00 AM,FEMENINO,BOYACA,Purdue University,Geotechnical Engineering,Ciencias Basicas,OTRAS INGENIERIAS Y TECNOLOGIAS,INGENIERIA CIVIL
Doctorados Exterior 2012,2012,01/01/1900 12:00:00 AM,MASCULINO,BOGOTA D C,Swiss Federal Institute of Technology Zurich - Universidad Catolica De Lovaina - University of Cambridge,Doctorado en Economia de la Energia,Investigaciones en Energia y Mineria,OTRAS CIENCIAS SOCIALES,ECONOMIA
Doctorados Exterior 2012,2012,01/01/1900 12:00:00 AM,MASCULINO,BOGOTA D C,University Of Leicester,PhD in Management,Ciencia Tecnologia e Innovacion en Ciencias Humanas Sociales y  Educacion,OTRAS CIENCIAS SOCIALES,NEGOCIOS Y MANAGEMENT
Doctorados Exterior 2012,2012,10/12/1986 12:00:00 AM,MASCULINO,CALDAS,University of California Berkeley - Georg August Universitat Gottingen Alemania - Johns Hopkins University,Ph.D in Neuroscience (o similar),Ciencia Tecnologia e Innovacion en Salud,OTRAS CIENCIAS MEDICAS,MEDICINA GENERAL E INTERNA
Doctorados Exterior 2012,2012,12/04/1985 12:00:00 AM,MASCULINO,BOGOTA D C,Delft University of Technology - McGill University - University of Bristol,PhD in Aerospace Engineering,Ciencia Tecnologia e Innovacion en Ingenieria,OTRAS INGENIERIAS Y TECNOLOGIAS,INGENIERIA AEROESPACIAL
Doctorados Exterior 2012,2012,01/01/1900 12:00:00 AM,MASCULINO,BOGOTA D C,Universidad De Sao Paulo - Universidad De Sao Paulo,Epidemiologia Experimental Aplicada as Zoonoses,Ciencia Tecnologia e Innovacion en Salud,OTRAS BIOLOGIAS,BIOLOGIA TEORICA MATEMATICA CRIOBIOLOGIA EVOLUTIVA
Doctorados Exterior 2012,2012,06/07/1975 12:00:00 AM,MASCULINO,BOGOTA D C,UNIVERSIDAD POLITECNICA DE CATALUNA - University of Washington - Universidad de California Los Angeles,Doctorado en Urbanismo,Ciencia Tecnologia e Innovacion en Ciencias Humanas Sociales y  Educacion,OTRAS CIENCIAS SOCIALES,ESTUDIOS URBANOS PLANIFICACION Y DESARROLLO
Doctorados Exterior 2012,2012,01/01/1900 12:00:00 AM,MASCULINO,VALLE DEL CAUCA,University of California San Diego,Ph.D. en Ingenieria Estructural,Ciencia Tecnologia e innovacion en Ambiente Biodiversidad y Habitat,OTRAS INGENIERIAS Y TECNOLOGIAS,INGENIERIA CIVIL
Doctorados Exterior 2012,2012,01/01/1900 12:00:00 AM,FEMENINO,BOGOTA D C,CASE WESTERN RESERVE UNIVERSITY - OHIO - University Of New Mexico,Doctoral of phylosophy in biology,Ciencias Basicas,OTRAS BIOLOGIAS,OTRAS BIOLOGIAS
Doctorados Exterior 2012,2012,01/01/1900 12:00:00 AM,FEMENINO,VALLE DEL CAUCA,Purdue University,Food Science graduate program,Biotecnologia,OTRAS CIENCIAS MEDICAS,NUTRICION Y DIETAS
Doctorados Exterior 2012,2012,03/11/1979 12:00:00 AM,MASCULINO,BOGOTA D C,Universidad Autonoma de Nuevo Leon,Doctorado en Ciencias-Orientacion Biologia Molecular e Ingenieria Genetica,Ciencia Tecnologia e Innovacion en Salud,OTRAS BIOLOGIAS,BIOQUIMICA Y BIOLOGIA MOLECULAR
Doctorados Exterior 2014,2014,01/01/1900 12:00:00 AM,MASCULINO,BOGOTA D C,Laval University,Doctorat en genie des eaux,Investigaciones en Energia y Mineria,CIENCIAS NATURALES,CIENCIAS DE LA TIERRA Y MEDIOAMBIENTALES
Doctorados Exterior 2012,2012,11/04/1983 12:00:00 AM,FEMENINO,ANTIOQUIA,Purdue University - Georgia Institute of Technology - Florida international University,Doctor of Philosophy with major in Heat Transfer,No Aplica,OTRAS INGENIERIAS Y TECNOLOGIAS,INGENIERIA MECANICA
Doctorados Exterior 2012,2012,11/07/1984 12:00:00 AM,MASCULINO,SANTANDER,UNIVERSIDAD AUTONOMA DE BARCELONA - Ecole doctorale de sciencies economiques - Universite de la Mediterranee AIX-Marseille II,Doctorado en ciencias economicas,Ciencia Tecnologia e Innovacion en Ciencias Humanas Sociales y  Educacion,OTRAS CIENCIAS SOCIALES,ECONOMIA
Doctorados Exterior 2012,2012,07/05/1983 12:00:00 AM,MASCULINO,HUILA,University of Minnesota,PhD in Applied Economics,No Aplica,OTRAS CIENCIAS SOCIALES,ECONOMIA
Doctorados Exterior 2012,2012,08/03/1986 12:00:00 AM,MASCULINO,BOGOTA D C,University of Paderborn - Politecnico Di Torino - Universidad Politecnica de Madrid,Doctorado en Automatica y Robotica,Ciencia Tecnologia e Innovacion en Ingenieria,OTRAS INGENIERIAS Y TECNOLOGIAS,INGENIERIA MECANICA
Doctorados Exterior 2012,2012,01/01/1900 12:00:00 AM,MASCULINO,CESAR,Ohio State University - University Of Wisconsin - Madison - Universidad federal de itajuba,PhD in Chemical Engineering,Investigaciones en Energia y Mineria,OTRAS INGENIERIAS Y TECNOLOGIAS,INGENIERIA CIVIL
Doctorados Exterior 2012,2012,09/02/1981 12:00:00 AM,FEMENINO,BOGOTA D C,London School of Economics - University of Gothenburg  - Maastrisht University,Phd en Economia Ambiental,Ciencia Tecnologia e Innovacion en Ciencias Humanas Sociales y  Educacion,OTRAS CIENCIAS SOCIALES,ECONOMIA
Doctorados Exterior 2012,2012,01/01/1900 12:00:00 AM,FEMENINO,BOGOTA D C,The University of Illinois at Urbana-Champaign - University of Iowa - University of Maryland,Phd Economics,Ciencia Tecnologia e Innovacion en Ciencias Humanas Sociales y  Educacion,OTRAS CIENCIAS SOCIALES,ECONOMIA
Doctorados Exterior 2012,2012,01/01/1900 12:00:00 AM,MASCULINO,BOGOTA D C,Purdue University - Universitat Des Saarlandes,PULSe LIFE SCIENCE RESEARCH,Biotecnologia,OTRAS BIOLOGIAS,CIENCIAS NATURALES
Doctorados Exterior 2012,2012,01/01/1900 12:00:00 AM,MASCULINO,BOGOTA D C,North Carolina State University,PhD in Design,Ciencia Tecnologia e Innovacion en Ciencias Humanas Sociales y  Educacion,OTRAS HUMANIDADES,EDUCACION GENERAL INCLUYE CAPACITACION PEDADOGIA
Doctorados Exterior 2012,2012,01/01/1900 12:00:00 AM,MASCULINO,BOGOTA D C,Arizona State University - Clark University - Univeristy of South Florida,Ph.D. in Geography,Ciencia Tecnologia e Innovacion en Tecnologias de la Informacion y las Comunicaciones,OTRAS INGENIERIAS Y TECNOLOGIAS,INGENIERIA CIVIL
Doctorados Exterior 2012,2012,01/01/1900 12:00:00 AM,FEMENINO,VALLE DEL CAUCA,Universidad de Valencia Espana,Doctorado en Contabilidad,No Aplica,OTRAS CIENCIAS SOCIALES,ECONOMIA
Doctorados Exterior 2012,2012,07/12/1983 12:00:00 AM,MASCULINO,BOGOTA D C,The University of Illinois at Urbana-Champaign - University of California San Diego,Department of animal biology,Ciencia Tecnologia e innovacion en Ambiente Biodiversidad y Habitat,OTRAS BIOLOGIAS,ZOOLOGIA ORNITOLOGIA ENTOMOLOGIA CIENCIAS BIOLOGICAS DEL COMPORTAMIENTO
Doctorados Exterior 2012,2012,05/07/1974 12:00:00 AM,MASCULINO,ANTIOQUIA,OREGON STATE UNIVERSITY - British Columbia University - University Of Goettingen,Instituto Universitario de Investigacion en Gestion Forestal Sostenible,Ciencia Tecnologia e innovacion en Ambiente Biodiversidad y Habitat,OTRAS CIENCIAS AGRICOLAS,FORESTAL
Doctorados Exterior 2012,2012,01/01/1900 12:00:00 AM,MASCULINO,BOGOTA D C,UNIVERSIDAD CARLOS III DE MADRID,Doctorado en Documentacion Archivos y Bibliotecas en el Entorno Digital,Ciencia Tecnologia e Innovacion en Ciencias Humanas Sociales y  Educacion,OTRAS CIENCIAS SOCIALES,CIENCIAS DE LA INFORMACION ASPECTOS SOCIALES
Doctorados Exterior 2012,2012,01/08/1989 12:00:00 AM,MASCULINO,CASANARE,University Of Salford,PhD Program in architectural acoustics Schools,Ciencia Tecnologia e Innovacion en Ingenieria,OTRAS INGENIERIAS Y TECNOLOGIAS,INGENIERIA CIVIL
Doctorados Exterior 2012,2012,10/02/1983 12:00:00 AM,MASCULINO,ATLANTICO,Universidad Helmut Schmidt - RWTH Universidad de Aachen - universidad federal de campinas,Doctorado en Ingenieria,Ciencia Tecnologia e Innovacion en Ingenieria,OTRAS INGENIERIAS Y TECNOLOGIAS,INGENIERIA MECANICA
Doctorados Exterior 2012,2012,01/01/1900 12:00:00 AM,FEMENINO,SANTANDER,City University London,Ciencias humanas,Ciencia Tecnologia e Innovacion en Ciencias Humanas Sociales y  Educacion,OTRAS HUMANIDADES,PSICOLOGIA INCLUYE TERAPIAS DE APRENDIZAJE HABLA VISUAL Y OTRAS DISCAPACIDADES FISICAS Y MENTALES
Doctorados Exterior 2012,2012,01/01/1900 12:00:00 AM,MASCULINO,SANTANDER,Universidad De Manchester,Research Programme Development Policy  Management,Ciencia Tecnologia e Innovacion en Ciencias Humanas Sociales y  Educacion,CIENCIAS NATURALES,CIENCIAS NATURALES
Doctorados Exterior 2012,2012,01/01/1900 12:00:00 AM,FEMENINO,ANTIOQUIA,UNIVERSIDAD COMPLUTENSE DE MADRID - UNIVERSIDAD CARLOS III DE MADRID,Doctorado en Derecho,No Aplica,OTRAS CIENCIAS SOCIALES,DERECHO
Doctorados Exterior 2012,2012,01/01/1900 12:00:00 AM,MASCULINO,CHOCO,UNIVERSIDAD AUTONOMA DE BARCELONA - UNIVERSIDAD AUTONOMA DE BARCELONA - Instituto De Empresa De Madrid,Doctorado Internacional en Creacion y Gestion de empresas,Ciencia Tecnologia e Innovacion en Ingenieria,OTRAS CIENCIAS SOCIALES,NEGOCIOS Y MANAGEMENT
Doctorados Exterior 2012,2012,01/01/1900 12:00:00 AM,FEMENINO,RISARALDA,Instituto Tecnologico y de Estudios Superiores de Monterrey,Doctorado en Ciencias de la Ingenieria,Ciencia Tecnologia e innovacion en Ambiente Biodiversidad y Habitat,OTRAS INGENIERIAS Y TECNOLOGIAS,INGENIERIA QUIMICA PLANTAS Y PRODUCTOS
Doctorados Exterior 2012,2012,04/06/1984 12:00:00 AM,FEMENINO,BOGOTA D C,TECHNISCHE UNIVERSITAT MUNCHEN,Ciencias basicas,Ciencias Basicas,OTRAS BIOLOGIAS,ECOLOGIA
Doctorados Exterior 2012,2012,01/01/1900 12:00:00 AM,MASCULINO,ATLANTICO,New York University - nottingham University - Durham University,Doctorado en finanzas,Ciencia Tecnologia e Innovacion en Ciencias Humanas Sociales y  Educacion,OTRAS CIENCIAS SOCIALES,NEGOCIOS Y MANAGEMENT
Doctorados Exterior 2012,2012,12/03/1987 12:00:00 AM,FEMENINO,BOGOTA D C,Columbia University In The City of New York - University of Birmingham - Durham University,PhD en marketing,Ciencia Tecnologia e Innovacion en Ciencias Humanas Sociales y  Educacion,OTRAS CIENCIAS SOCIALES,NEGOCIOS Y MANAGEMENT
Doctorados Exterior 2012,2012,11/05/1984 12:00:00 AM,FEMENINO,NO APLICA,Indiana University - THE UNIVERSITY OF TEXAS AT AUSTIN. - University of California Davis,Anthropology,Ciencia Tecnologia e Innovacion en Ciencias Humanas Sociales y  Educacion,OTRAS HUMANIDADES,ANTROPOLOGIA
Doctorados Exterior 2012,2012,01/01/1900 12:00:00 AM,MASCULINO,PUTUMAYO,Washington State University,Paul G. Allen School for Global Animal Health,No Aplica,OTRAS BIOLOGIAS,BIOLOGIA TEORICA MATEMATICA CRIOBIOLOGIA EVOLUTIVA
Doctorados Exterior 2012,2012,01/01/1900 12:00:00 AM,FEMENINO,CAUCA,Harvard University - New York University - London School of Economics,Doctorado en Politica Publica,Ciencia Tecnologia e Innovacion en Ciencias Humanas Sociales y  Educacion,OTRAS CIENCIAS SOCIALES,NEGOCIOS Y MANAGEMENT
Doctorados Exterior 2012,2012,01/01/1900 12:00:00 AM,MASCULINO,SUCRE,Yale University - Harvard Kennedy School - The University Of Chicago Law School,JD PROGRAM,Ciencia Tecnologia e Innovacion en Ciencias Humanas Sociales y  Educacion,OTRAS CIENCIAS SOCIALES,DERECHO
Doctorados Exterior 2012,2012,11/09/1976 12:00:00 AM,MASCULINO,ANTIOQUIA,University of Cambridge - University of East Anglia - Universidade de Sao Paulo,PhD Zoology,Ciencias Basicas,OTRAS BIOLOGIAS,ZOOLOGIA ORNITOLOGIA ENTOMOLOGIA CIENCIAS BIOLOGICAS DEL COMPORTAMIENTO
Doctorados Exterior 2012,2012,02/06/1987 12:00:00 AM,MASCULINO,ANTIOQUIA,UNIVERSITY OF MASSACHUSETTS/AMHERST,Graduate Program in Physics,Ciencias Basicas,GEOCIENCIAS MULTIDISCIPLINARIO,FISICA ATOMICA MOLECULAR Y QUIMICA
Doctorados Exterior 2012,2012,10/08/1981 12:00:00 AM,MASCULINO,BOGOTA D C,Yale University - Universidad De Siegen - LEcole des hautes etudes en sciences sociales,Sciences Sociales,Ciencia Tecnologia e Innovacion en Ciencias Humanas Sociales y  Educacion,OTRAS HUMANIDADES,FILOSOFIA
Doctorados Exterior 2012,2012,01/01/1900 12:00:00 AM,MASCULINO,ATLANTICO,Universitat De Valencia,Estadistica y Optimizacion,Ciencias Basicas,OTRAS INGENIERIAS Y TECNOLOGIAS,INGENIERIA DE PRODUCCION
Doctorados Exterior 2012,2012,01/01/1900 12:00:00 AM,FEMENINO,ATLANTICO,Universidad Autonoma de Barcelona - Goldsmiths University of London - Purdue University,Doctorado en Antropologia,Ciencia Tecnologia e Innovacion en Ciencias Humanas Sociales y  Educacion,OTRAS HUMANIDADES,ANTROPOLOGIA
Doctorados Exterior 2012,2012,01/01/1900 12:00:00 AM,MASCULINO,BOGOTA D C,University of Nevada Reno - University Of Iowa,Psicologia,Ciencia Tecnologia e Innovacion en Ciencias Humanas Sociales y  Educacion,OTRAS HUMANIDADES,PSICOLOGIA INCLUYE TERAPIAS DE APRENDIZAJE HABLA VISUAL Y OTRAS DISCAPACIDADES FISICAS Y MENTALES
Doctorados Exterior 2012,2012,08/04/1982 12:00:00 AM,MASCULINO,VALLE DEL CAUCA,THE UNIVERSITY OF GEORGIA - Universidad De Barcelona - 2.	UNIVERSIDAD COMPLUTENSE DE MADRID,Ph. D. Ecology,Ciencias Basicas,OTRAS BIOLOGIAS,OTRAS BIOLOGIAS
Doctorados Exterior 2012,2012,03/02/1988 12:00:00 AM,MASCULINO,ANTIOQUIA,University College London - University Of Toronto - The University of Melbourne,PhD - Genetics Evolution and Environment,Ciencias Basicas,OTRAS BIOLOGIAS,GENETICA Y HERENCIA
Doctorados Exterior 2012,2012,01/01/1900 12:00:00 AM,MASCULINO,BOGOTA D C,PURDUE UNIVERSITY - INDIANA - New Mexico State University - CORNELL UNIVERSITY,PHD. ELECTRICAL AND COMPUTER ENGINEERING. RESEARCH AREA MICROELECTRONICS A,Ciencia Tecnologia e Innovacion en Tecnologias de la Informacion y las Comunicaciones,OTRAS INGENIERIAS Y TECNOLOGIAS,INGENIERIA ELECTRICA Y ELECTRONICA
Doctorados Exterior 2012,2012,01/01/1900 12:00:00 AM,FEMENINO,BOGOTA D C,2.	UNIVERSIDAD COMPLUTENSE DE MADRID  - 2.	UNIVERSIDAD COMPLUTENSE DE MADRID,Doctorado en Gobierno y Administracion Publica,Ciencia Tecnologia e Innovacion en Ciencias Humanas Sociales y  Educacion,OTRAS CIENCIAS SOCIALES,DERECHO
Doctorados Exterior 2012,2012,05/03/1974 12:00:00 AM,MASCULINO,BOGOTA D C,Purdue University,Doctoral Program in Engineering Education,Ciencia Tecnologia e Innovacion en Ciencias Humanas Sociales y  Educacion,OTRAS INGENIERIAS Y TECNOLOGIAS,INGENIERIA ELECTRICA Y ELECTRONICA
Doctorados Exterior 2012,2012,01/01/1900 12:00:00 AM,MASCULINO,ANTIOQUIA,MASSACHUSETTS INSTITUTE OF TECHNOLOGY - Harvard University - Johns Hopkins University,DOCTOR OF PHILOSOPHY (PHD),Ciencia Tecnologia e Innovacion en Salud,OTRAS INGENIERIAS Y TECNOLOGIAS,INGENIERIA MEDICA
Doctorados Exterior 2012,2012,10/03/1982 12:00:00 AM,MASCULINO,BOGOTA D C,Universidad Pompeu Fabra,Doctorado en Humanidades,Ciencia Tecnologia e Innovacion en Ciencias Humanas Sociales y  Educacion,OTRAS HUMANIDADES,FILOSOFIA
Doctorados Exterior 2012,2012,01/01/1900 12:00:00 AM,MASCULINO,BOGOTA D C,Universite De Paris X (Paris-Nanterre),Doctorats Sciences Technologies Sante Mecanique,Ciencia Tecnologia e Innovacion en Salud,OTRAS INGENIERIAS Y TECNOLOGIAS,INGENIERIA MECANICA
Doctorados Exterior 2012,2012,05/05/1985 12:00:00 AM,FEMENINO,BOGOTA D C,University of Cambridge,PhD in Zoology,Ciencias Basicas,OTRAS BIOLOGIAS,GENETICA Y HERENCIA
Doctorados Exterior 2012,2012,01/01/1900 12:00:00 AM,MASCULINO,BOGOTA D C,Universite de Valenciennes et du Hainaut-Cambresis,Doctoral Program PSI Team TEMPO lab Universite de Valenciennes,Ciencia Tecnologia e Innovacion en Ingenieria,OTRAS INGENIERIAS Y TECNOLOGIAS,INGENIERIA DE PRODUCCION
Doctorados Exterior 2012,2012,04/04/1985 12:00:00 AM,FEMENINO,BOGOTA D C,Sydney University  - University of Oxford - Columbia University,Stem Cell Research PhD,Ciencia Tecnologia e Innovacion en Salud,OTRAS CIENCIAS MEDICAS,MEDICINA GENERAL E INTERNA
Doctorados Exterior 2012,2012,01/01/1900 12:00:00 AM,FEMENINO,VALLE DEL CAUCA,Wageningen University - UNESCO-IHE Institute for Water Education,Environmental System Analysis,Ciencia Tecnologia e innovacion en Ambiente Biodiversidad y Habitat,CIENCIAS NATURALES,CIENCIAS NATURALES
Doctorados Exterior 2012,2012,01/01/1900 12:00:00 AM,FEMENINO,VALLE DEL CAUCA,University of Bristol - University of Southampton - University of Manchester,Doctorado en Medicina social (epidemiologia social e inequidades en salud),Ciencia Tecnologia e Innovacion en Salud,OTRAS CIENCIAS MEDICAS,SALUD PUBLICA
Doctorados Exterior 2012,2012,11/02/1983 12:00:00 AM,MASCULINO,BOYACA,Universidade Estadual De Maringa - Escola Superior Luiz de Queiroz,Programa Nacional de Formacion de Investigadores,No Aplica,OTRAS CIENCIAS AGRICOLAS,AGRONOMIA
Doctorados Exterior 2012,2012,01/01/1900 12:00:00 AM,MASCULINO,VALLE DEL CAUCA,University of Massachusetts,Sociologia,Ciencia Tecnologia e Innovacion en Ciencias Humanas Sociales y  Educacion,OTRAS HUMANIDADES,SOCIOLOGIA
