NOMBRE_CONVOCATORIA,AÑO_CONVOCATORIA,FECHA_NACIMIENTO_ASPIRANTE,GENERO_ASPIRANTE,DPTO_NACIMIENTO_ASPIRANTE,POSIBLES_INSTITUCIONES_DE_ESTUDIO,PROGRAMA_DOCTORAL,PROG_NAL_CYT,GRAN_AREA_CONOCIMIENTO_ESTUDIO,AREA_CONOCIMIENTO_ESTUDIO
Doctorados Exterior 2011,2011,07/03/1984 12:00:00 AM,MASCULINO,BOGOTA D C,UNIVERSITY OF WISCONSIN-MADISON - Northwestern University - Yale University,PhD en Ciencia Politica,Ciencia Tecnologia e Innovacion en Ciencias Humanas Sociales y  Educacion,OTRAS HUMANIDADES,CIENCIAS POLITICAS
Doctorados Exterior 2011,2011,01/01/1900 12:00:00 AM,MASCULINO,BOGOTA D C,The Australian National University - Washington State University - Purdue University,Mejoramiento genetico vegetal,Biotecnologia,OTRAS BIOLOGIAS,GENETICA Y HERENCIA
Doctorados Exterior 2011,2011,10/01/1981 12:00:00 AM,MASCULINO,CUNDINAMARCA,Universidad De Purdue,gestion cultural y comunicativa,Ciencia Tecnologia e Innovacion en Ciencias Humanas Sociales y  Educacion,OTRAS HUMANIDADES,SOCIOLOGIA
Doctorados Exterior 2011,2011,11/07/1983 12:00:00 AM,MASCULINO,CALDAS,Purdue University - The University of Illinois at Urbana-Champaign - University of Michigan,Doctorado en Ingenieria Electrica,Ciencia Tecnologia e Innovacion en Tecnologias de la Informacion y las Comunicaciones,OTRAS INGENIERIAS Y TECNOLOGIAS,INGENIERIA ELECTRICA Y ELECTRONICA
Doctorados Exterior 2011,2011,05/07/1977 12:00:00 AM,MASCULINO,ANTIOQUIA,Ecole Polytechnique de Montreal,Ph.D. Ingenieria Mecanica,Ciencia Tecnologia e Innovacion en Ingenieria,OTRAS INGENIERIAS Y TECNOLOGIAS,INGENIERIA MECANICA
Doctorados Exterior 2011,2011,05/09/1988 12:00:00 AM,FEMENINO,BOGOTA D C,University Of Leicester - Rijksuniversiteit Groningen,PhD in Management,Ciencia Tecnologia e Innovacion en Ciencias Humanas Sociales y  Educacion,OTRAS CIENCIAS SOCIALES,MEDIOS Y COMUNICACION SOCIAL
Doctorados Exterior 2011,2011,04/03/1975 12:00:00 AM,MASCULINO,BOYACA,Universite Paris Diderot - Paris 7 - Universite Paris 7 - Denis Diderot - Universidad Paris 1 Pantheon - Sorbonne,Doctorat de recherche en psychopathologie et psychanalyse,Ciencia Tecnologia e Innovacion en Ciencias Humanas Sociales y  Educacion,OTRAS HUMANIDADES,PSICOLOGIA INCLUYE TERAPIAS DE APRENDIZAJE HABLA VISUAL Y OTRAS DISCAPACIDADES FISICAS Y MENTALES
Doctorados Exterior 2011,2011,08/08/1981 12:00:00 AM,FEMENINO,SANTANDER,Harvard University - New York University - Columbia University In The City of New York,Doctorado en Derecho,Ciencia Tecnologia e Innovacion en Ciencias Humanas Sociales y  Educacion,OTRAS CIENCIAS SOCIALES,DERECHO
Doctorados Exterior 2011,2011,11/03/1980 12:00:00 AM,MASCULINO,BOGOTA D C,Harvard University-The Graduate School of Arts and Sciences - Architectural Association School Of Architecture,PhD en Arquitectura,Ciencia Tecnologia e Innovacion en Ciencias Humanas Sociales y  Educacion,OTRAS CIENCIAS SOCIALES,ARQUITECTURA Y URBANISMO
Doctorados Exterior 2011,2011,05/01/1979 12:00:00 AM,FEMENINO,CHOCO,Georg August Universitat Gottingen Alemania - Oregon State University - British Columbia University,Doctorado en Ciencia y Biologia de la madera,Ciencias Basicas,OTRAS BIOLOGIAS,OTRAS BIOLOGIAS
Doctorados Exterior 2011,2011,01/01/1900 12:00:00 AM,MASCULINO,MAGDALENA,Centro de Investigacion y Asistencia en Tecnologia y Diseno de Jalisco - Universidad de Cordoba,DOCTORADO EN BIOTECNOLOGIA PRODUCTIVA,Biotecnologia,OTRAS CIENCIAS AGRICOLAS,AGRICULTURA
Doctorados Exterior 2011,2011,01/01/1900 12:00:00 AM,FEMENINO,ANTIOQUIA,University of California Berkeley - Texas A M university - UNIVERSITY OF FLORIDA,Doctorado en Ingenieria Biologica,Biotecnologia,OTRAS INGENIERIAS Y TECNOLOGIAS,INGENIERIA QUIMICA PLANTAS Y PRODUCTOS
Doctorados Exterior 2011,2011,11/08/1983 12:00:00 AM,MASCULINO,SANTANDER,Universidade de Sao Paulo,Programa de Pos-Graduacion en Ingenieria Mecanica,Investigaciones en Energia y Mineria,OTRAS INGENIERIAS Y TECNOLOGIAS,INGENIERIA MECANICA
Doctorados Exterior 2011,2011,05/03/1977 12:00:00 AM,FEMENINO,BOGOTA D C,University of California Berkeley - Tufts University - THE UNIVERSITY OF TEXAS AT AUSTIN.,Educacion Matematica Ciencias y Tecnologia,Ciencia Tecnologia e Innovacion en Ciencias Humanas Sociales y  Educacion,OTRAS HUMANIDADES,EDUCACION GENERAL INCLUYE CAPACITACION PEDADOGIA
Doctorados Exterior 2011,2011,01/01/1900 12:00:00 AM,MASCULINO,BOGOTA D C,Universitat Politecnica de Catalunya - University Of Bradford,Doctorado en Sostenibilidad,Ciencia Tecnologia e innovacion en Ambiente Biodiversidad y Habitat,OTRAS CIENCIAS SOCIALES,ESTUDIOS URBANOS PLANIFICACION Y DESARROLLO
Doctorados Exterior 2011,2011,01/08/1977 12:00:00 AM,MASCULINO,BOGOTA D C,City University Of New York - Utah State University - University of Florida,Doctorado en Biologia,Ciencias Basicas,OTRAS BIOLOGIAS,OTRAS BIOLOGIAS
Doctorados Exterior 2011,2011,04/02/1979 12:00:00 AM,MASCULINO,CUNDINAMARCA,The University of Edimburgh - UNIVERSIDAD NACIONAL DE CORDOBA - Centro Agronomico Tropical de Investigacion y Ensenanza,Doctor of Philosophy-Ph.D.,Ciencia Tecnologia e innovacion en Ambiente Biodiversidad y Habitat,OTRAS BIOLOGIAS,OTRAS BIOLOGIAS
Doctorados Exterior 2011,2011,01/01/1900 12:00:00 AM,FEMENINO,SANTANDER,university of vermont - University of California Santa Cruz - Stony Brook University,doctorado,Ciencias Basicas,OTRAS BIOLOGIAS,ECOLOGIA
Doctorados Exterior 2011,2011,09/10/1986 12:00:00 AM,FEMENINO,BOGOTA D C,Stockholm University - Lund University - University of Uppsala,Social ecological resilience for sustainable development,Ciencia Tecnologia e innovacion en Ambiente Biodiversidad y Habitat,OTRAS HUMANIDADES,SOCIOLOGIA
Doctorados Exterior 2011,2011,01/01/1900 12:00:00 AM,FEMENINO,SANTANDER,Universite dOrleans,Convocatoria nacional para estudios de doctorado en el exterior 2011. N.529,Ciencia Tecnologia e Innovacion en Ciencias Humanas Sociales y  Educacion,LINGUISTICA,LINGUISTICA
Doctorados Exterior 2011,2011,06/12/1986 12:00:00 AM,MASCULINO,CAUCA,Universitat De Girona,Doctorado en Tecnologia,Ciencia Tecnologia e Innovacion en Tecnologias de la Informacion y las Comunicaciones,GEOCIENCIAS MULTIDISCIPLINARIO,CIENCIAS DE LA COMPUTACION
Doctorados Exterior 2012,2012,01/01/1900 12:00:00 AM,FEMENINO,BOGOTA D C,Universidad De Bonn,Doctorado en Biologia farmaceutica,Biotecnologia,OTRAS BIOLOGIAS,BIOLOGIA CELULAR Y MICROBIOLOGIA
Doctorados Exterior 2011,2011,08/07/1986 12:00:00 AM,MASCULINO,ANTIOQUIA,Universidad de Michigan - University of Texas at Austin - The University of Illinois at Urbana-Champaign,Doctorado en Matematicas,Ciencias Basicas,GEOCIENCIAS MULTIDISCIPLINARIO,MATEMATICAS PURAS
Doctorados Exterior 2011,2011,01/01/1900 12:00:00 AM,FEMENINO,ANTIOQUIA,Columbia University In The City of New York - University of Cambridge - University Of Michigan - Ann Arbor,Doctorado en Epidemiologia,Ciencia Tecnologia e Innovacion en Salud,OTRAS CIENCIAS MEDICAS,SALUD PUBLICA
Doctorados Exterior 2011,2011,01/01/1900 12:00:00 AM,MASCULINO,ANTIOQUIA,Universidad de Navarra - TECNUN - UNIVERSIDAD POLITECNICA DE MADRID - UNIVERSIDAD DE SANTIAGO DE CHILE,Doctorado en Ingenieria aplicada gestion tecnologica,Ciencia Tecnologia e Innovacion en Ingenieria,OTRAS INGENIERIAS Y TECNOLOGIAS,INGENIERIA DE PRODUCCION
Doctorados Exterior 2011,2011,01/01/1900 12:00:00 AM,MASCULINO,BOGOTA D C,Cranfield University,PhD en la Facultad de Ingenieria,Ciencia Tecnologia e Innovacion en Ingenieria,OTRAS INGENIERIAS Y TECNOLOGIAS,INGENIERIA AEROESPACIAL
Doctorados Exterior 2011,2011,01/01/1900 12:00:00 AM,MASCULINO,VALLE DEL CAUCA,Purdue University - RMIT University,Doctor of Philosophy  (Electrical and Computer Engineering),Ciencia Tecnologia e Innovacion en Tecnologias de la Informacion y las Comunicaciones,OTRAS INGENIERIAS Y TECNOLOGIAS,INGENIERIA ELECTRICA Y ELECTRONICA
Doctorados Exterior 2011,2011,01/01/1900 12:00:00 AM,FEMENINO,BOGOTA D C,UNIVERSIDAD DE BUENOS AIRES - Universidad Nacional Autonoma de Mexico - UNIVERSIDAD DE SAO PAULO,Doctorado en Ciencias Sociales,Ciencia Tecnologia e Innovacion en Ciencias Humanas Sociales y  Educacion,OTRAS HUMANIDADES,SOCIOLOGIA
Doctorados Exterior 2011,2011,01/01/1900 12:00:00 AM,MASCULINO,VALLE DEL CAUCA,CORNELL UNIVERSITY - Stanford University - Massachussetts Institute of Technology,Doctorado en Ingenieria Ambiental y Recursos Hidricos,Ciencia Tecnologia e innovacion en Ambiente Biodiversidad y Habitat,OTRAS INGENIERIAS Y TECNOLOGIAS,INGENIERIA CIVIL
Doctorados Exterior 2011,2011,01/01/1900 12:00:00 AM,FEMENINO,BOGOTA D C,University of Southern California - New York University - Massachusetts Institute of Technology,Neurociencias,Ciencia Tecnologia e Innovacion en Salud,OTRAS CIENCIAS MEDICAS,MEDICINA GENERAL E INTERNA
Doctorados Exterior 2011,2011,01/01/1900 12:00:00 AM,FEMENINO,NORTE DE SANTANDER,University Of Alabama - University of Minnesota - University of Alabama,Metodos cuantitativos aplicados a la investigacion en Educacion,Ciencias Basicas,GEOCIENCIAS MULTIDISCIPLINARIO,ESTADISTICAS Y PROBABILIDADES INVESTIGACION EN METODOLOGIAS
Doctorados Exterior 2011,2011,01/01/1900 12:00:00 AM,FEMENINO,VALLE DEL CAUCA,Duke University - Georgia Tech - Harvard University,Program in Genetics and Genomics,Ciencia Tecnologia e Innovacion en Salud,OTRAS BIOLOGIAS,GENETICA Y HERENCIA
Doctorados Exterior 2011,2011,02/10/1974 12:00:00 AM,MASCULINO,META,Universidad De Harvard - University Of Michigan - Ann Arbor - MASSACHUSETTS INSTITUTE OF TECHNOLOGY,PhD in Social Policy,Ciencia Tecnologia e Innovacion en Ciencias Humanas Sociales y  Educacion,OTRAS CIENCIAS SOCIALES,ECONOMIA
Doctorados Exterior 2011,2011,06/09/1978 12:00:00 AM,FEMENINO,BOGOTA D C,Johns Hopkins University - Universidad De Miami - Mount Sinai Medical Center,Ph.D. human genetics,Ciencia Tecnologia e Innovacion en Salud,OTRAS CIENCIAS MEDICAS,MEDICINA GENERAL E INTERNA
Doctorados Exterior 2011,2011,01/01/1900 12:00:00 AM,MASCULINO,ATLANTICO,Stanford University - Harvard University - University of California at Berkeley,PhD en Psicologia,Ciencia Tecnologia e Innovacion en Ciencias Humanas Sociales y  Educacion,OTRAS HUMANIDADES,PSICOLOGIA INCLUYE TERAPIAS DE APRENDIZAJE HABLA VISUAL Y OTRAS DISCAPACIDADES FISICAS Y MENTALES
Doctorados Exterior 2011,2011,01/01/1900 12:00:00 AM,FEMENINO,ANTIOQUIA,Radboud University Nijmegen - Erasmus University Rotterdam - Universidad de Groningen,Molecular Life Sciences,Ciencias Basicas,OTRAS BIOLOGIAS,OTRAS BIOLOGIAS
Doctorados Exterior 2011,2011,04/11/1983 12:00:00 AM,MASCULINO,SANTANDER,Virginia Tech - University Of Wisconsin - Madison - PENNSYLVANIA STATE UNIVERSITY,Doctorado en Ingenieria Industrial (Sistemas de Produccion y manufactura),Ciencia Tecnologia e Innovacion en Ingenieria,OTRAS INGENIERIAS Y TECNOLOGIAS,INGENIERIA DE PRODUCCION
Doctorados Exterior 2011,2011,01/01/1900 12:00:00 AM,MASCULINO,BOGOTA D C,University of Oxford,DPhil in Zoology,Ciencia Tecnologia e innovacion en Ambiente Biodiversidad y Habitat,OTRAS BIOLOGIAS,ECOLOGIA
Doctorados Exterior 2011,2011,02/09/1978 12:00:00 AM,FEMENINO,ANTIOQUIA,University of Illinois - Michigan State University - UNIVERSITY OF FLORIDA,Lenguaje Cognicion Creatividad y Educacion.,Ciencia Tecnologia e Innovacion en Ciencias Humanas Sociales y  Educacion,OTRAS HUMANIDADES,EDUCACION GENERAL INCLUYE CAPACITACION PEDADOGIA
Doctorados Exterior 2011,2011,01/07/1977 12:00:00 AM,FEMENINO,NORTE DE SANTANDER,University of California Berkeley - City of New York University - UNIVERSITY OF ILLINOIS AT CHICAGO,Doctorado en Geografia / Planeamiento Urbano,Ciencia Tecnologia e innovacion en Ambiente Biodiversidad y Habitat,OTRAS CIENCIAS SOCIALES,ESTUDIOS URBANOS PLANIFICACION Y DESARROLLO
Doctorados Exterior 2011,2011,01/01/1900 12:00:00 AM,FEMENINO,BOGOTA D C,Universidade Estadual de Campinas - Univerisdad Nacional Autonoma de Mexico - ESCOLA SUPERIOR DE AGRICULTURA LUIZ DE QUEIROZ.,Doctorado en Ecologia,Ciencias Basicas,OTRAS BIOLOGIAS,ECOLOGIA
Doctorados Exterior 2011,2011,01/01/1900 12:00:00 AM,MASCULINO,NARINO,universidad estadual paulista julio de mesquita filho,DOCORADO EN CIENCIAS CARTOGRAFICAS,Ciencia Tecnologia e Innovacion en Tecnologias de la Informacion y las Comunicaciones,GEOCIENCIAS MULTIDISCIPLINARIO,GEOCIENCIAS MULTIDISCIPLINARIO
Doctorados Exterior 2011,2011,08/03/1984 12:00:00 AM,FEMENINO,CUNDINAMARCA,Escola superior de agricultura Luiz de Queiroz - Auburn University - University of California Riverside,Entomologia,Ciencia Tecnologia e Innovacion en Ciencias Agropecuarias,OTRAS CIENCIAS AGRICOLAS,AGRONOMIA
Doctorados Exterior 2011,2011,11/06/1982 12:00:00 AM,FEMENINO,BOYACA,London School of Hygiene  Tropical Medicine - Swiss Tropical and Public Health Institute - Fundacion Oswaldo Cruz,Doctorado en Epidemiologia,Ciencia Tecnologia e Innovacion en Salud,OTRAS CIENCIAS MEDICAS,MEDICINA GENERAL E INTERNA
Doctorados Exterior 2011,2011,01/01/1900 12:00:00 AM,MASCULINO,BOGOTA D C,New York University - TULANE UNIVERSITY - Columbia University In The City of New York,Spanish and Portuguese Languages and Literatures,Ciencia Tecnologia e Innovacion en Ciencias Humanas Sociales y  Educacion,LINGUISTICA,ESTUDIOS GENERALES DEL LENGUAJE
Doctorados Exterior 2011,2011,07/11/1982 12:00:00 AM,FEMENINO,ANTIOQUIA,Universidad De Reims Champagne Ardenne,Doctorado Ciencias Tecnologia Salud,Ciencia Tecnologia e Innovacion en Salud,OTRAS INGENIERIAS Y TECNOLOGIAS,COMPUESTOS LAMINADOS PLASTICOS REFORZADOS FIBRA SINTETICAS Y NATURALES ETC
Doctorados Exterior 2011,2011,01/01/1900 12:00:00 AM,FEMENINO,BOGOTA D C,Freie Universitat Berlin - Universidade Fernando Pessoa - Institut national de la recherche scientifique Universite du Quebec,Doctorado en Farmacia,Ciencia Tecnologia e Innovacion en Salud,OTRAS CIENCIAS MEDICAS,FARMACOLOGIA Y FARMACIA
Doctorados Exterior 2011,2011,09/05/1974 12:00:00 AM,MASCULINO,BOGOTA D C,The University of Manchester,Politicas Publicas,Ciencia Tecnologia e Innovacion en Ciencias Humanas Sociales y  Educacion,OTRAS CIENCIAS SOCIALES,ECONOMIA
Doctorados Exterior 2011,2011,08/11/1981 12:00:00 AM,MASCULINO,SANTANDER,Universidad Politecnica de Valencia,Ingenieria Hidraulica y Medio Ambiente,Ciencia Tecnologia e innovacion en Ambiente Biodiversidad y Habitat,GEOCIENCIAS MULTIDISCIPLINARIO,GEOCIENCIAS MULTIDISCIPLINARIO
Doctorados Exterior 2011,2011,01/01/1900 12:00:00 AM,MASCULINO,BOGOTA D C,Purdue University,PhD in biological sciences,Biotecnologia,OTRAS BIOLOGIAS,OTRAS BIOLOGIAS
Doctorados Exterior 2011,2011,01/01/1900 12:00:00 AM,FEMENINO,ANTIOQUIA,Tulane University,Doctor of Philosophy degree in Business Administration,Ciencias Basicas,CIENCIAS NATURALES,OTRAS CIENCIAS NATURALES
Doctorados Exterior 2011,2011,01/01/1900 12:00:00 AM,FEMENINO,ANTIOQUIA,Universidad Complutence de Madrid - Universidad Nebrija,Doctorado en Marketing,Ciencia Tecnologia e Innovacion en Tecnologias de la Informacion y las Comunicaciones,OTRAS CIENCIAS SOCIALES,CIENCIAS DE LA INFORMACION ASPECTOS SOCIALES
Doctorados Exterior 2011,2011,01/01/1900 12:00:00 AM,FEMENINO,BOYACA,Erasmus University - Universite catholique de Louvain - University of Amsterdam,Biomedical science,Ciencia Tecnologia e Innovacion en Salud,OTRAS CIENCIAS MEDICAS,MEDICINA GENERAL E INTERNA
Doctorados Exterior 2011,2011,01/01/1900 12:00:00 AM,MASCULINO,NO APLICA,Institut dUrbanisme de Paris - Universite Paris-Est (Creteil-Val de Marne),Urbanismo y equipamiento,Ciencia Tecnologia e Innovacion en Ciencias Humanas Sociales y  Educacion,OTRAS CIENCIAS SOCIALES,DERECHO
Doctorados Exterior 2011,2011,07/07/1981 12:00:00 AM,FEMENINO,BOGOTA D C,University College London,PhD Economics,Ciencia Tecnologia e Innovacion en Ciencias Humanas Sociales y  Educacion,OTRAS CIENCIAS SOCIALES,ECONOMIA
Doctorados Exterior 2011,2011,06/08/1982 12:00:00 AM,FEMENINO,BOGOTA D C,Yale University - Stanford University - Harvard University,Doctorado en Ciencia Politica,Ciencia Tecnologia e Innovacion en Ciencias Humanas Sociales y  Educacion,OTRAS HUMANIDADES,CIENCIAS POLITICAS
Doctorados Exterior 2011,2011,07/01/1984 12:00:00 AM,FEMENINO,BOYACA,Universidad de Barcelona - Universidad de Valencia Espana,Doctorado en quimica Organica,Ciencias Basicas,GEOCIENCIAS MULTIDISCIPLINARIO,QUIMICA ORGANICA
Doctorados Exterior 2011,2011,01/01/1900 12:00:00 AM,FEMENINO,BOGOTA D C,Universidad De Heidelberg - Max Planck Institute for Infection Biology International Max Planck Researc,International graduate school of molecular  cellular biology,Biotecnologia,OTRAS BIOLOGIAS,BIOQUIMICA Y BIOLOGIA MOLECULAR
Doctorados Exterior 2011,2011,01/01/1900 12:00:00 AM,FEMENINO,BOGOTA D C,University of Florida,Animal Sciences,Ciencias Basicas,OTRAS BIOLOGIAS,ZOOLOGIA ORNITOLOGIA ENTOMOLOGIA CIENCIAS BIOLOGICAS DEL COMPORTAMIENTO
Doctorados Exterior 2011,2011,06/03/1986 12:00:00 AM,MASCULINO,SANTANDER,University of Miami - Fundacion Universitaria de Cardiologia,Doctoral studies (Ph.D.) in Endocrinology Diabetes and Metabolism,Ciencia Tecnologia e Innovacion en Salud,OTRAS CIENCIAS MEDICAS,MEDICINA GENERAL E INTERNA
Doctorados Exterior 2011,2011,10/07/1986 12:00:00 AM,FEMENINO,BOGOTA D C,University of Notre Dame  - Syracuse University - Miami University,Ph.D en Ciencia Politica con enfoque en Estudios de Paz,Ciencia Tecnologia e Innovacion en Ciencias Humanas Sociales y  Educacion,OTRAS HUMANIDADES,CIENCIAS POLITICAS
Doctorados Exterior 2011,2011,01/01/1900 12:00:00 AM,FEMENINO,NORTE DE SANTANDER,Georgetown University - George Washington University - Universidad Complutense De Madrid,Doctorado en Derecho,Ciencia Tecnologia e Innovacion en Ciencias Humanas Sociales y  Educacion,OTRAS CIENCIAS SOCIALES,DERECHO
Doctorados Exterior 2011,2011,05/05/1979 12:00:00 AM,MASCULINO,VALLE DEL CAUCA,Michigan State University - Washington State University - Universidad de Tasmania,Doctor of Philosophi (PhD) in Biosystems Engineering,Ciencia Tecnologia e Innovacion en Ingenieria,OTRAS CIENCIAS AGRICOLAS,ALIMENTOS Y BEBIDAS
Doctorados Exterior 2011,2011,02/05/1983 12:00:00 AM,MASCULINO,BOGOTA D C,Columbia University - Massachusetts Institute Of Technology - Harvard University-The Graduate School of Arts and Sciences,Doctorado en Planeacion Urbana,Ciencia Tecnologia e innovacion en Ambiente Biodiversidad y Habitat,OTRAS CIENCIAS SOCIALES,ARQUITECTURA Y URBANISMO
Doctorados Exterior 2011,2011,01/01/1900 12:00:00 AM,MASCULINO,CAUCA,UNIVERSITY OF WISCONSIN-MADISON - University of California - Princeton University,PhD in Sociology,Ciencia Tecnologia e Innovacion en Ciencias Humanas Sociales y  Educacion,OTRAS CIENCIAS SOCIALES,DEMOGRAFIA
Doctorados Exterior 2011,2011,01/01/1900 12:00:00 AM,MASCULINO,RISARALDA,Universidad De Tilburg - Universidad de Eberhard Karls - City University of New York,Ciencias de la salud,Ciencia Tecnologia e Innovacion en Salud,GEOCIENCIAS MULTIDISCIPLINARIO,ASTRONOMIA
Doctorados Exterior 2011,2011,01/01/1900 12:00:00 AM,MASCULINO,BOGOTA D C,The Pennsylvania State University - University of Florida - University of Washington,PhD in Information Sciences and Technology,Ciencia Tecnologia e Innovacion en Ciencias Humanas Sociales y  Educacion,OTRAS HUMANIDADES,EDUCACION GENERAL INCLUYE CAPACITACION PEDADOGIA
Doctorados Exterior 2011,2011,05/04/1973 12:00:00 AM,MASCULINO,ANTIOQUIA,University of Westminster,PHD IN COMMUNICATION AND MEDIA STUDIES,Ciencia Tecnologia e Innovacion en Ingenieria,CIENCIAS NATURALES,CIENCIAS NATURALES
Doctorados Exterior 2011,2011,01/01/1900 12:00:00 AM,FEMENINO,LA GUAJIRA,Universidad de California Berkeley - Standford University - Universidade de Sao Paulo,PhD in Chemical Engineering,Investigaciones en Energia y Mineria,OTRAS INGENIERIAS Y TECNOLOGIAS,INGENIERIA QUIMICA PLANTAS Y PRODUCTOS
Doctorados Exterior 2011,2011,01/01/1900 12:00:00 AM,FEMENINO,QUINDIO,University of California Berkeley - University Of Southern California - University of California Santa Barbara,Doctorado en ingenieria electronica,Ciencia Tecnologia e Innovacion en Ingenieria,OTRAS INGENIERIAS Y TECNOLOGIAS,INGENIERIA ELECTRICA Y ELECTRONICA
Doctorados Exterior 2011,2011,08/11/1987 12:00:00 AM,MASCULINO,BOGOTA D C,UNIVERSIDAD DE BUENOS AIRES,Doctorado en derecho,Ciencia Tecnologia e Innovacion en Ciencias Humanas Sociales y  Educacion,OTRAS CIENCIAS SOCIALES,DERECHO
Doctorados Exterior 2011,2011,01/01/1900 12:00:00 AM,FEMENINO,BOGOTA D C,UNIVERSIDAD AUTONOMA DE BARCELONA - London School of Economics - UNIVERSIDAD COMPLUTENSE DE MADRID,Historia Comparada Politica y Social,Ciencia Tecnologia e Innovacion en Ciencias Humanas Sociales y  Educacion,OTRAS HUMANIDADES,HISTORIA
Doctorados Exterior 2011,2011,01/01/1900 12:00:00 AM,MASCULINO,ATLANTICO,Universidad De Edinburgo,PhD in Science and Technology Studies,Ciencia Tecnologia e Innovacion en Ciencias Humanas Sociales y  Educacion,CIENCIAS NATURALES,OTRAS CIENCIAS SOCIALES
Doctorados Exterior 2011,2011,01/01/1900 12:00:00 AM,MASCULINO,SUCRE,Louisiana State University Health Sciences Center,MICROBIOLOGY IMMUNOLOGY AND PARASITOLOGY,Ciencias Basicas,OTRAS BIOLOGIAS,OTRAS BIOLOGIAS
Doctorados Exterior 2011,2011,04/02/1984 12:00:00 AM,MASCULINO,BOGOTA D C,University of Auckland,Doctorado en Educacion Matematica,Ciencia Tecnologia e Innovacion en Ciencias Humanas Sociales y  Educacion,OTRAS HUMANIDADES,EDUCACION GENERAL INCLUYE CAPACITACION PEDADOGIA
Doctorados Exterior 2011,2011,01/01/1900 12:00:00 AM,MASCULINO,NO APLICA,Hamburg Universitat - Hamburg Universitat,Phd. Politikwissenschaft,Ciencia Tecnologia e Innovacion en Ciencias Humanas Sociales y  Educacion,OTRAS CIENCIAS SOCIALES,ECONOMIA
Doctorados Exterior 2011,2011,01/01/1900 12:00:00 AM,MASCULINO,RISARALDA,University Of Bristol,PHD in Philosophy,Ciencia Tecnologia e Innovacion en Ciencias Humanas Sociales y  Educacion,OTRAS HUMANIDADES,FILOSOFIA
Doctorados Exterior 2011,2011,01/01/1900 12:00:00 AM,FEMENINO,BOGOTA D C,International Max Planck Research School of Advanced Materials - Technische Universitat Munchen - Universidade de Sao Paulo,PhD Training Programme in Advanced Materials,Investigaciones en Energia y Mineria,OTRAS INGENIERIAS Y TECNOLOGIAS,INGENIERIA QUIMICA PLANTAS Y PRODUCTOS
Doctorados Exterior 2011,2011,01/01/1900 12:00:00 AM,FEMENINO,BOGOTA D C,Universidad de Concepcion - Universidad Nacional del Mar del Plata,Doctorado en Linguistica,Ciencia Tecnologia e Innovacion en Ciencias Humanas Sociales y  Educacion,LINGUISTICA,LINGUISTICA
Doctorados Exterior 2011,2011,01/01/1900 12:00:00 AM,MASCULINO,BOGOTA D C,Universidad De Berna,Ph.D. Faculty of Natural Sciences of the University of Berne,Ciencia Tecnologia e innovacion en Ambiente Biodiversidad y Habitat,GEOCIENCIAS MULTIDISCIPLINARIO,GEOCIENCIAS MULTIDISCIPLINARIO
Doctorados Exterior 2011,2011,01/01/1900 12:00:00 AM,MASCULINO,VALLE DEL CAUCA,University Of Wisconsin - Madison - Georgetown University - University of Florida,Ph.D in Economics,Ciencia Tecnologia e Innovacion en Ciencias Humanas Sociales y  Educacion,OTRAS CIENCIAS SOCIALES,ECONOMIA
Doctorados Exterior 2011,2011,01/01/1900 12:00:00 AM,MASCULINO,ANTIOQUIA,Iowa State University,Ph.D. in Electrical Engineering,Investigaciones en Energia y Mineria,OTRAS INGENIERIAS Y TECNOLOGIAS,INGENIERIA ELECTRICA Y ELECTRONICA
Doctorados Exterior 2011,2011,01/01/1900 12:00:00 AM,MASCULINO,VALLE DEL CAUCA,University of Main,Ph.d. IN FOREST RESOURCES,Ciencia Tecnologia e innovacion en Ambiente Biodiversidad y Habitat,OTRAS INGENIERIAS Y TECNOLOGIAS,INGENIERIA QUIMICA PLANTAS Y PRODUCTOS
Doctorados Exterior 2011,2011,01/01/1900 12:00:00 AM,MASCULINO,ANTIOQUIA,Purdue University,The Nanoelectronic modeling group,Ciencia Tecnologia e Innovacion en Tecnologias de la Informacion y las Comunicaciones,GEOCIENCIAS MULTIDISCIPLINARIO,CIENCIAS DE LA COMPUTACION
Doctorados Exterior 2011,2011,03/07/1985 12:00:00 AM,FEMENINO,ANTIOQUIA,Instituto Oswaldo Cruz - Fiocruz - London School of Hygiene and Tropical Medicine - Universidad de California Los Angeles,Epidemiologia (Duracion 60 meses),Ciencia Tecnologia e Innovacion en Salud,OTRAS CIENCIAS MEDICAS,MEDICINA GENERAL E INTERNA
Doctorados Exterior 2011,2011,12/10/1982 12:00:00 AM,MASCULINO,CALDAS,Technical University of Denmark - Eindhoven University Of Technology - Swiss Federal Institute of Technology Zurich,PhD. en Ingenieria Mecanica,Ciencia Tecnologia e Innovacion en Ingenieria,OTRAS INGENIERIAS Y TECNOLOGIAS,INGENIERIA MECANICA
Doctorados Exterior 2011,2011,10/08/1979 12:00:00 AM,MASCULINO,BOGOTA D C,State University of New York - Binghamton,Doctorado en filosofia social politica etica y legal,Ciencia Tecnologia e Innovacion en Ciencias Humanas Sociales y  Educacion,OTRAS HUMANIDADES,FILOSOFIA
Doctorados Exterior 2011,2011,09/04/1976 12:00:00 AM,MASCULINO,BOGOTA D C,Purdue University,Doctorado en Ingenieria Farmaceutica,Ciencia Tecnologia e Innovacion en Salud,OTRAS CIENCIAS MEDICAS,FARMACOLOGIA Y FARMACIA
Doctorados Exterior 2011,2011,01/01/1900 12:00:00 AM,MASCULINO,ANTIOQUIA,Washington University in St. Louis - Illinois State University,Molecular Microbiology and Microbial Pathogenesis,Ciencia Tecnologia e Innovacion en Salud,OTRAS BIOLOGIAS,BIOLOGIA TEORICA MATEMATICA CRIOBIOLOGIA EVOLUTIVA
Doctorados Exterior 2011,2011,01/01/1900 12:00:00 AM,MASCULINO,BOGOTA D C,Texas AM - UCdavis,Agricultural and Resources Economics,Ciencia Tecnologia e Innovacion en Ciencias Humanas Sociales y  Educacion,OTRAS CIENCIAS SOCIALES,ECONOMIA
Doctorados Exterior 2011,2011,07/07/1979 12:00:00 AM,FEMENINO,CUNDINAMARCA,University of Gothenburg - Wageningen University - Norwegian University of Life Sciences,FOREST CLIMATE AND LIVELIHOODS RESEARCH,Ciencia Tecnologia e innovacion en Ambiente Biodiversidad y Habitat,OTRAS CIENCIAS AGRICOLAS,FORESTAL
Doctorados Exterior 2011,2011,01/01/1900 12:00:00 AM,FEMENINO,ATLANTICO,UNIVERSIDAD DE BUENOS AIRES - The university of New South Wales - University of New England,Gestion Ambiental,Ciencia Tecnologia e innovacion en Ambiente Biodiversidad y Habitat,OTRAS CIENCIAS SOCIALES,DERECHO
